GO,Genes,Gene_Count,Term_Description,50perc_contaminated_Genes,100perc_contaminated_Genes
GO:0048627,MEGF10 SDC1 WNT10B SOX15,4,myoblast development,MEGF10 WNT10B PDP2 INSL5,ENPP6 NAA80 BBS7 AJUBA
GO:1904888,CPLANE2 NEUROG1 GRHL2 TGFB3 EXT1 TGFBR2 TWIST1 EDNRA WDR19 MED12 TGFB2 PAX5 NDST1 FOXE1 EIF4A3 RAB23 DCANP1 TP63 WNT9B TFAP2A IFT140 GLI3 PDGFRA ZIC3 INSIG1 MMP16 CHST11 CTNNB1 NIPBL INSIG2 IRX5 NOG SIX2 TBX1 TGFBR1 RIC1 COLEC10 TIFAB FOXN3 FGFR2 RDH10 CRKL TMEM107 FOXC2 SLC39A1 SMAD2 SIX1 FREM1 RUNX2 SIX4 MTHFD1 GNA11 IRF6 MTHFD1L LHX1 NODAL PRRX1 BMP4 MSX2 TULP3 MEGF8 FGF8 CEP55 SMAD3 MMP14 SETD2 TBX15 DLX2 HOXA2 FGF4 SLC39A3 HOXA1,72,cranial skeletal system development,TFAP2A SIX4 MTHFD1L FGFR2 GNA11 TGFB3 IFT140 MEGF8 CEP55 MED12 DLX2 LHX1 SETD2 SMAD2 TP63 TULP3 TBX15 HOXA2 EXT1 EDNRA CPLANE2 PDGFRA SIX1 INSIG2 COLEC10 CTNNB1 GRHL2 TGFBR2 TBX1 NOG TWIST1 NDST1 WNT9B MMP16 CRKL SIX2 EIF3K PARVG TMEM127 POGK SCPEP1 PNPO RWDD2B SCNN1A RFX1 CTAG1B PERM1 H2BC13 ZNF283 H2AC7 NECAP1 CBR3 CDK3 CCDC93 SPMAP2 SLC41A1 OR4D11 DPP10 CLDN8 EIF3C TMPRSS11D AP2A2 BNIPL ZNF416 SLC52A1 BUD13 ZNF33A TAS1R3 OR8A1 NKAIN4 PWWP2A SHISA6,LIFR ASB7 DEDD2 WSB1 USP51 OR2V2 CREBZF ELOVL4 IL1R2 SDHAF4 ZIM3 NUP88 OR52W1 VN1R2 ACSM5 PARM1 DNTT GPR139 IL22RA2 RAD23A MADCAM1 MRPS17 PRSS12 UAP1 PSG2 PHPT1 CWF19L2 PLAU OR51Q1 BEGAIN PSCA FUNDC2 CABIN1 RSPH4A SPRR2A CST9 A2ML1 OR6C68 PHC1 YAE1 MGAT5 SFXN3 DGCR8 ZNF821 KCNIP3 SSR1 GDPD2 NOC3L MED17 CCL5 SCIMP ZSWIM8 ECHDC2 TRABD2B RASSF9 RNF146 STX18 RNF103-CHMP3 CIDEA SIRPB1 PPAT ZSWIM7 RIOX1 RGS16 CLDN25 SUCLG1 SCTR OR2B11 MFSD9 ARHGAP17 SLC9A9 ABI3BP
GO:0019585,DCXR UGT1A9 UGT2B7 PRKCE UGT1A7 UGT2A3 SORD UGT1A10 UGT1A1 UGT1A3 UGT2A1 UGT1A5 XYLB CRYL1 UGT2B4 AKR1A1 UGT2B15 UGT2B17 UGT2A2 UGT2B28 UGT1A6 UGT2B10 UGT1A8 UGT1A4 UGT2B11 ABHD10,26,glucuronate metabolic process,AKR1A1 DCXR UGT2A1 UGT2B7 UGT2A2 UGT2B28 UGT1A3 UGT2B17 UGT1A5 PRKCE UGT2B15 SORD UGT1A1 PHAF1 RFLNA TCP11L1 CD8A RPL10 HSPB3 RPS18 CYP11A1 OMA1 SC5D OS9 CFAP206 CWC27,MSRB2 RAB3A DLL1 ERCC2 PIP4K2B HOXB13 TIMM50 ZNF444 NRCAM KIF2A NEUROG3 BACH1 RIN3 SRP9 OR2T27 FBXO40 MC2R GALNT5 PPP2R1A RALGAPB LGALS14 MFAP5 SPNS1 PBXIP1 PTGES3L PCDHB16
GO:1902267,AZIN1 OAZ2 OAZ1 AZIN2 OAZ3,5,regulation of polyamine transmembrane transport,AZIN1 OAZ1 OR10A4 ZBTB10 BLNK,AP4B1 ULK4 MYCBP2 CD86 YTHDC2
GO:0019748,BDH2 CYP2A7 AKR1C1 ACMSD ATP7A ASIP DDT CYP3A4 CYP1B1 CYP1A1 APPL1 AKR1B1 MC1R AKR1C3 CYP1A2 UGT1A7 OCA2 CYP2W1 CDH3 WNT5A SULT1C4 CTNS CITED1 AKR1C4 TYRP1 DCT FMO2 AKR7A2 ARL1 TRPC1 SLC7A11 CYP2A13 TH AKR1B10 AS3MT CYP2A6 RAPGEF2 ZEB2 CBR4 N6AMT1 OPN3 AKR1C2 SLC24A5 RAB38 GIPC1 BCL2 MFSD12 NFE2L2 AKR1A1 TYR UGT1A8 SLC45A2 CYP2D6 PMEL CYP3A5 FMO1,56,secondary metabolic process,AKR7A2 FMO1 UGT1A8 APPL1 WNT5A SULT1C4 ACMSD MFSD12 SLC45A2 CYP3A5 ASIP BDH2 AKR1C4 OPN3 CYP2A13 ARL1 SLC24A5 AKR1A1 UGT1A7 CYP2A6 CDH3 TYRP1 ZEB2 TH CYP2W1 CTNS CYP2D6 CYP2A7 CSPG5 CYTH2 MPZL1 CD101 NAPB ESPNL DOCK4 OR7A10 GLP2R DOK1 FCRL5 KCNS1 OSER1 MRGPRD GPR153 SEPTIN14 TM4SF1 SLC7A14 OR6J1 SLC9A2 LENG1 OR2T6 IGSF3 MRC1 EVL NET1 RASGRP4 IFT70A,CHRNB3 H2BC7 PSD ARL5B CLEC4C BSPH1 FREY1 POTEI CORO7 CKAP5 ZNF106 MORN4 RAB44 KRT25 OR2T5 C1QL3 CACNA1S H2AC4 SYT8 HLA-DRB4 CSAG1 MAMDC4 TLN1 ISM1 MYO5C CRACR2A XKR4 OR4F21 NOMO2 TBC1D20 CEP57L1 SLURP2 RAB6B TUBB2B CLRN1 PSG2 ARL4D WASHC2C KCNAB3 PROKR1 ASPN STEEP1 PCDHGC4 GUCD1 BFSP1 AQP7 C1QL2 SLC35E2B CLEC4D SYT15 ADGRA3 CD300LG TMEM88B PCDH8 SLC12A5 CCL28
GO:0006122,CYC1 UQCRB UQCRC1 UQCR10 CYCS UQCC3 UQCRQ UQCRHL UQCR11 CYTB UQCRH UQCRC2 UQCRFS1,13,"mitochondrial electron transport, ubiquinol to cytochrome c",UQCRC1 UQCRFS1 UQCC3 CYTB UQCRC2 CYCS NID1 RCOR2 PPP1R13B GAGE2C NSD3 RGCC GDPD2,TAF1D QRFP PPP1R9A RBP4 NFS1 ALDH7A1 CEP83 INVS CHMP2A AOX1 SF3B4 ROCK2 E2F4
GO:0030071,SPC24 TTK CDC6 PBRM1 MAD2L1BP SMARCB1 ANAPC5 FBXO5 HECW2 IK RIOK2 TPR ARID1A PCID2 TEX14 RAD21 ACTB KNL1 PLK1 SMARCD1 BUB1B GEN1 NSMCE2 SMARCD2 ARID1B CUL3 USP44 BCL7A SMARCC1 XRCC3 MAD1L1 HASPIN NEK6 MAP3K20 PSMG2 BCL7C SMARCC2 ACTL6A KNTC1 SPC25 SMARCD3 SMARCE1 ZWINT CCNB1 BUB3 SMARCA2 ESPL1 ARID2 ZNF207 ACTL6B ANAPC4 SPDL1 ATM BCL7B ANAPC11 CDC16 BRD7 PRAP1 ANAPC15 BIRC5 DUSP1 MAD2L2 DPF3 NDC80 MAD2L1 BUB1 CDC23 DPF1 PHF10 KLHL22 APC CDK5RAP2 RB1 DPF2 CDCA8 UBE2C INCENP SMARCA4 ZWILCH CENPE DLGAP5 CDC20 NUF2 LCMT1 TRIP13 AURKB CENPF DYNC1LI1 ZW10,89,regulation of mitotic metaphase/anaphase transition,NEK6 BUB3 ARID1A SMARCD1 ESPL1 MAP3K20 ZW10 TRIP13 ACTB BCL7C DPF1 ACTL6A ATM BCL7B ARID2 SMARCD3 DPF3 ANAPC4 SMARCC2 SMARCE1 SMARCD2 SPC25 SMARCB1 MAD1L1 DYNC1LI1 BCL7A SPC24 PBRM1 BRD7 INCENP CDCA8 CENPF CDC23 NUF2 APC SMARCA4 BUB1B TPR PSMG2 USP44 ZWINT DLGAP5 PCID2 KLHL22 ETNK2 TMEM144 OR4K5 CALCA HIPK4 ACKR2 ZNF814 MAP3K15 CRTAP FTHL17 REPIN1 ASB7 OR14J1 PERM1 HACD4 ITPA ZNF676 KPTN NOD2 PLEKHM3 NGF TAPT1 ARMC10 ADCY10 DNAH12 TIMM21 ATL2 FBXL14 BCOR KIF17 GGNBP2 SST KRTAP1-1 TGM2 H2AZ2 CRACD MYL4 MVP NAA15 CNNM4 TMEM120B APOA2 WNT2 TICAM1 SEMA3E,PLA2G1B ITGA3 PREX1 SLC5A8 ANXA6 RABGGTA MLNR ETFRF1 IL10 IFNG MYCBPAP EME1 USP12 CIZ1 TSPY4 SLC29A4 NUMBL UGT2B7 ZNF780B CSNK2A1 DEDD POLR1B TCTN2 CDK20 IDNK GDF10 ZNF496 GRK1 PPM1H SLC10A7 ARMCX5-GPRASP2 TSKU GKN2 TIMM13 ZNF730 ZNF829 SLC3A1 PTCHD1 TALDO1 MAP9 KLK3 ARID3B JMY CNTNAP3 ZNF814 IL20 BEGAIN IRS1 SH3TC2 ZNF223 TIRAP GOT1 STX5 ANKRD54 SLC52A3 ZNF638 USP6NL OMP SDSL MEOX1 PARVA MAL2 PRG2 CLEC10A MARVELD3 KLF17 SLC6A4 SULT1A4 ACBD7 GLRX TBPL1 MSMO1 HOMER2 KIR3DL1 ARHGEF28 NR5A2 FGD5 SPRN ZNF233 SPAST SRSF1 ANKS6 RILP OR4F6 SAFB2 FGF6 CLC SGF29 CCNA1
GO:0090660,DNAH9 AQP4 CFAP221 DAW1 ODAD3 CFAP45 CFAP54 KATNIP JHY CCDC39 DNAAF11 CFAP43 SPAG16 ODAD4 NHERF1,15,cerebrospinal fluid circulation,CFAP54 CFAP221 AQP4 KATNIP ODAD3 JHY NHERF1 NOP16 CLPSL2 DUXA CTBP1 TMEM203 HMGB4 ZNF862 MRPL3,ZNF234 ZDHHC4 TIMP1 GRIK4 SLC15A4 AKIRIN1 TUBGCP5 OST4 RIN1 CDC45 WDR45B NAF1 MXD3 PLVAP REG3G
GO:0006754,PRKAG2 TREM2 ATP5MG ATPSCKMT NDUFS8 ATP5MC2 ADCY10 NDUFS5 DMAC2L ATP5MF NDUFB8 ATP8 SDHA NDUFS1 ANTKMT ND3 SDHD TMSB4X NDUFB10 ATP5F1C NDUFB7 ALDOA ND2 NDUFB2 NDUFA1 ATP6V1A NDUFAB1 COX11 ND4L NDUFB1 NDUFV3 ATP5PD NDUFA2 NDUFA8 ND6 FLCN IL4 NDUFB6 ATP5F1A NDUFB5 ATP5PO NDUFA13 ATP6V0C ATP6 NDUFV1 DNAJC30 ATP5MC3 PINK1 NDUFA6 PPARGC1A ATP5F1B ND1 NDUFS2 TAFAZZIN NDUFA11 ND5 NDUFA7 NDUFS6 ND4 ENO1 SLC25A13 ATP5PB NDUFV2 LDHC SPHK2 PARP1 VPS9D1 UQCC3 NDUFA9 ATP5ME TGFB1 NDUFA12 NDUFB9 NDUFS7 NUDT2 ATP5MC1 ATP5PF NDUFB4 NDUFS4 PID1 ATP5MGL NDUFS3 SDHC ATP5F1E NDUFA3 VCP ATP5MJ ATP5MK NDUFA10 ATP5F1D SDHB NDUFC2 NDUFB3 PPARA NDUFB11 LIPA NDUFC1 STOML2 NDUFA5,99,ATP biosynthetic process,NDUFA5 COX11 PRKAG2 ATP5F1D VCP NDUFB1 PINK1 ATP5PD PPARGC1A ALDOA ATP5F1C NDUFB4 ND4L ADCY10 NDUFC1 NDUFA3 ENO1 ATP5MG TAFAZZIN SPHK2 NDUFB8 NDUFB6 NUDT2 NDUFB3 PPARA SDHC DNAJC30 ATP5MC3 NDUFC2 ATP5F1B NDUFB10 ATP8 NDUFV3 ATPSCKMT NDUFA7 ATP5PB NDUFA12 ND3 PARP1 NDUFA1 UQCC3 STOML2 SLC25A13 NDUFAB1 VPS9D1 NDUFA11 NDUFV2 NDUFS2 ATP5MC2 SLC45A1 QRFP IKZF5 TLCD4 CCNL2 DPPA5 MEIOB ZNF341 HNRNPH2 IRX1 TOP2B INSM1 SPACA5 MAT2A PITRM1 PIAS1 LHFPL3 TNNI1 HSPH1 RHCE BRK1 PKN1 EIF3D ADPRH CAMSAP1 KRT16 LACRT KATNAL1 SLC10A5 PLPP5 ZNF75A SPOP ZFP69B ZNF708 OBP2B DDX49 MARCHF3 PAX6 COQ10A USP40 COL13A1 ZIM2 HLA-G TCHP MMD SAXO1 OR8U1 CFAP126 TTLL10 PRSS16,ZNF415 OR4N5 PPM1A RECK HRAS PLK5 FAU MRPL41 RBM7 SDHAF4 ITIH5 VKORC1 PIP4P2 SERINC4 ERO1A CAMK2N1 OR1L3 MTDH MRPL51 TNKS2 PHETA1 MEI1 CDKL4 MRGPRD RBPJL PRKD3 PPP4R1 SLC4A5 CHRNB4 AMY2A RP1 CYC1 TXNDC17 SPPL3 CCS CCDC187 PDIA2 SLC44A4 PCDH18 WFIKKN1 GLIS1 GPRC5C CPB1 SHROOM1 NPM3 TCL1A RP9 IRX3 SLC15A1 SLC25A48 CAAP1 DPP6 TRIM21 ATP13A5 PDGFRB ZBTB8A GRIN2C DEK HYI INO80C CCDC68 USP45 CSH1 NIT1 MAGED4B SHPRH UMPS MNX1 IRF1 ZNF546 HOXD4 CMPK1 CHRNA5 PEPD GGCX HFE LMBRD2 CPT1A MUC2 UQCRC2 NR2C2 DIRAS2 C5 PPA2 ALDH1A1 BST2 ZNF410 PPAN SMPDL3B SIL1 UQCC4 METTL21A UPP1 SPIRE2 TTC9B CHAMP1 MAGEB18 TOPBP1 NOX3
GO:0043615,NR2E1 HEXB GPR183 CCL3 SCRIB CCL2 MMP14 APCDD1 CCR2,9,astrocyte cell migration,NR2E1 SCRIB APCDD1 GPR183 TRIP6 SIGLEC9 ROBO2 CHST2 ARHGEF12,P3H4 H1-1 TMED10 NPHP1 MAGED4B MYO10 GIGYF2 NCAPH2 DNAJB14
GO:0001711,RTF1 CDC73 SOX2 PAF1 LEO1 SOX17 CTR9 CTNNB1 EOMES MESP1 DKK1 GATA6 NANOG HNF1B POU5F1,15,endodermal cell fate commitment,CTNNB1 SOX17 CTR9 PAF1 CDC73 SOX2 MESP1 NCF4 KLK2 CLEC12B ZNF513 ZNF512B GC CABS1 UBAP2L,IKZF4 ZNG1A MMP28 CBR3 EIF3J OR4K15 DMXL2 XRCC5 P3H2 NIPAL2 CCNYL1 GNMT OR7D2 MACF1 DDA1
GO:0036058,PTPRO FKRP NPHS1,3,filtration diaphragm assembly,NPHS1 ANKK1 OR5AK2,PPM1D ARMC1 STON1-GTF2A1L
GO:0032277,INHBA OPRK1 NPVF INHBB INHA CRH TACR2 GJA1,8,negative regulation of gonadotropin secretion,OPRK1 NPVF TACR2 GJA1 NPAS1 AQP2 LCE1D DZIP1L,TTLL6 VARS1 EZH1 GLYATL1 NEMP1 PPFIA2 TAFAZZIN SCX
GO:0014002,LRP1 ROR2 NF1 TREM2 IFNGR1 C5AR1 VIM TSPAN2 POU3F2 KRAS LDLR CNTF GRN TTBK1 TNF ADORA2A NR1D1 DRD1 NAGLU ROR1 S100A8 LAMC3 CDK6 AGER ZEB2 MAPT IL1B IL6 PLP1 S100A9 IFNG C1QA PSEN1 EIF2B5 SMO DLL1 GFAP LAMB2 TLR4 EGFR APP,41,astrocyte development,LAMC3 EIF2B5 ROR2 NAGLU APP TSPAN2 LAMB2 SMO POU3F2 DLL1 ROR1 LDLR DRD1 VIM GFAP NR1D1 CDK6 PSEN1 S100A8 TLR4 COX7A2L CACNA1H IFT25 HPGDS DAZ2 CACNG3 PLEKHM3 CST9L RCAN1 MKNK2 LIPT2 NDNF CHN2 TSPAN8 TIGIT MARCHF10 SNPH GALR3 SMS CENPO TMEM268,OR4L1 USP29 ZNF653 RSL24D1 HYPK ARID1A ATOX1 ULBP3 GPR180 NPM3 VNN2 TCEANC2 CRLS1 KLHDC2 RPL6 NDUFAB1 KBTBD7 ANOS1 EVX1 WNT2B ARHGAP4 SLC22A7 GJA5 SEC14L1 ZNF334 PHAX CEP85L CYP3A43 GP1BA GNG11 OSBPL6 LIPA NUP85 CLDN22 SKIC2 NCOA7 BCL3 TCF7L1 SAMHD1 UPK2 PM20D1
GO:0015872,TGM2 SYT10 COMT SYT4 HTR2A OPRK1 SYT12 CHRNA6 SNCG SLC6A3 GDNF DRD3 SYT9 SYT11 ABAT KCNA2 SYT3 CHRNB2 SLC6A2 MAPK15 SLC18A2 FGF20 DRD1 SLC29A3 SLC22A3 SYT17 SYT15 SYT8 HTR1B GABBR1 PRKCB SYT5 SYT13 SYT2 TOR1A CXCL12 CHRNA4 SNCA SLC22A1 GRM2 PARK7 DRD2 SLC29A4 SYT1 CNR1 SLC22A2 DTNBP1 KPNA4 PRKN PINK1 SYT6 GNAT1 DRD4 RAB3B CHRM5 SYT7,56,dopamine transport,KCNA2 CHRM5 SNCG PARK7 SYT8 CXCL12 CHRNA6 COMT DRD1 DTNBP1 GRM2 TOR1A SLC22A3 MAPK15 SLC6A2 CHRNA4 SYT9 PRKCB SYT4 SYT10 HTR1B GABBR1 CHRNB2 SLC18A2 GDNF SYT3 FGF20 SYT17 KRT6B ARPC5L KIF11 SCRT1 GPRASP1 POGLUT3 POMP GZMB PATZ1 FCRL2 CBX2 H2AC8 TMEM38B SECISBP2 MS4A8 FOXE1 IQSEC1 WNT7A USP17L21 STH ATAT1 AKAP10 MIIP ADSL MORC3 COBL ACSBG1 PCDHGA8,SAP25 WDR24 RPS8 TRPM6 LINGO4 H4C2 PRAMEF6 LIN7C ASB4 CCL4 RBM14 DYNLRB1 RAB40AL SARS1 GPAT2 AKIP1 LGALS9B GAB3 RNF135 ZNF227 RNF43 CNOT1 TNFAIP8L2 SPA17 F5 CPNE3 STX2 TOMM40 KCNK17 SNRPA1 SLC34A3 TRIM68 CD47 KBTBD8 OR8B8 CHMP4A EPAS1 MORC3 B3GALNT2 PCDHB2 AXIN1 OR9K2 HERC2 ZNF622 ZMPSTE24 EPPIN DCTN6 WDR38 SCAPER SLAMF7 UMODL1 MFSD9 MRPL53 DEGS2 ARHGAP25 RNF145
GO:0032098,MKKS POMC GHSR NENF LEP SCTR BBS2 HTR4 SCT SLC22A3 NOD2 BBS4 SPX UCN GALP PPARA GHRL CARTPT HTR2C NPY,20,regulation of appetite,SLC22A3 UCN SCT NPY GHSR LEP NENF GALP SCTR HTR4 CCDC40 ATRN CABP4 SMR3B MPST GANAB CREB3L4 SPRY4 HBM FBXO38,PPP6R1 RPS3 DBNDD2 CD47 ACTBL2 TYSND1 TRAPPC12 SPAST AHNAK2 METTL9 TCF3 TRIM64B ZNF256 LCT AKAP17A FOXD2 NUDT8 VEPH1 OSTF1 RPS15
GO:0045162,NRCAM SPTBN4 MYOC AGRN SCLT1 GLDN,6,clustering of voltage-gated sodium channels,SPTBN4 GLDN MYOC DCAF12L1 HSD17B7 TSC22D2,HBQ1 ADRA2A GTPBP3 MYMX ONECUT2 TCTE1
GO:0060947,VEGFA MYOCD NOTCH1 MESP1 GATA6 GPER1 SRF HEY2,8,cardiac vascular smooth muscle cell differentiation,NOTCH1 VEGFA HEY2 GPER1 SCGB1A1 SECISBP2 TMOD1 CEP63,MYPOP TRIB3 CD34 UNCX UPK1A PLRG1 PLCH1 PRLR
GO:0071468,NOX1 SCNN1B RAB11FIP5 CHP1 ASIC2 PKD2L1 SCNN1A SLC9A1 PKD1L3 AQP10 SCNN1G RAB11B KCNE1 TRPV1 SCNN1D,15,cellular response to acidic pH,AQP10 RAB11FIP5 SCNN1A CHP1 TRPV1 ASIC2 SCNN1B FBXL20 FHDC1 SEMA3C RPL6 ZNF777 LSM4 DMBT1 PSKH2,OR2L8 COLGALT2 PCDH17 TFE3 TPPP3 OR2AG1 PCDHA11 OR56A5 UBA6 CABLES2 SKP2 TRIM7 TESK2 E2F6 PPEF2
GO:0099590,EPS15 CACNG8 AP2A2 EFNB2 NUMB HIP1 HPCA VAC14 CACNG3 GSG1L AP2M1 AP2A1 RALA OPHN1 PPP3R1 ARC SCRIB CALY CACNG5 CACNG4 SNAP25 CACNG2 SYNE1 LPAR1 CACNG7 AP2B1 ATAD1 AP2S1 DRD4 ITGB3 DNM3,31,neurotransmitter receptor internalization,HPCA CACNG5 SCRIB ARC AP2S1 SNAP25 CACNG4 AP2M1 VAC14 RALA EFNB2 CALY OPHN1 CACNG3 NUMB NUP58 JUP LGALS12 SLC9B2 UGGT1 TBCD NTAN1 COL4A6 MARCHF8 AIFM2 SPRR2B ARHGAP29 TIMD4 CADM3 EOMES SPRR1A,OR2AE1 EDC3 TNFRSF10D LANCL2 H3C2 PDE3B LY6G6D ZNF529 LCMT2 ABRACL POM121L2 SATB2 OR6C2 MT1B ACTR3B PLA2G4B UGT8 RIF1 MEGF10 ADCK2 MEPCE MYBPC3 HNRNPA1 DDX47 CRMP1 ATP6V0A4 NOTCH4 SF3A1 ZNF418 CCN2 L1TD1
GO:0090102,ZEB1 DCHS1 NEUROG1 CDH23 MYO3A DVL2 SOX9 DCANP1 SLITRK6 SLC26A5 FRZB EPHA4 TBX2 KCNK2 TBX18 PAFAH1B1 GABRB2 WNT5A RPGRIP1L GABRA5 POU3F4 GATA2 HES1 FZD2 TBX1 SOBP GRXCR1 HEY2 DVL1 PTK7 TIFAB IFT20 MCM2 KCNQ1 GRHL3 KCNK3 SIX1 CTHRC1 CECR2 CCNA2 PAX2 ADAM10 MYO3B CALB1 EYA1 MYO7A SLC17A8 HPN IFT27 HOXA1,50,cochlea development,SIX1 SLC26A5 DCHS1 NEUROG1 SOBP GABRA5 IFT20 CTHRC1 SOX9 HEY2 HOXA1 ZEB1 PAX2 CECR2 TBX1 DVL2 KCNK2 FRZB KCNK3 GATA2 TBX18 GRXCR1 POU3F4 EPHA4 FZD2 BACH1 KATNBL1 TEX264 ASPG DHFR2 ZNF146 SRP19 RSL1D1 ST7 ZDHHC18 PIP4K2B TAS2R14 PANK1 SEC61A2 LINS1 FTMT ZNF593 RPL28 BST1 PRKAG3 FAM170A FUBP3 ERV3-1-ZNF117 PSMD11 SLC19A1,CEP295 HBD CALHM4 DECR2 TBC1D3K RANBP17 TFF2 TUBE1 DMXL1 SELP ZNF107 GNRHR FILIP1L NCOA7 ARHGAP19 ACSF3 ZNF280B KIR2DS1 C1orf131 UBAP2L SLC22A11 RHBDD2 TEX101 CCNQ SLC27A5 GTF3A C1orf56 IPO4 PPP1R7 ZNF154 TECRL GSDMC GPR150 PEX19 OR6C76 HLA-DQA1 GABBR1 INAVA TNFAIP8L2 CHST15 ACSM4 IFNGR2 ARL1 MIEN1 ABHD12 HIGD1A TAS2R10 NEK11 ADGRE5 RTP1
GO:0031179,PGLYRP2 LANCL2 LANCL3 LANCL1 PAM GGT1,6,peptide modification,LANCL2 LANCL1 GGT1 SON POLD4 MEF2C,H2AC18 FLI1 GPN2 SERAC1 OR4K14 SLC25A17
GO:0006703,HSD17B8 HSD3B1 HSD17B11 HSD17B1 HSD17B12 HSD17B7 HSD17B2 AKR1B15 DHRS11 CYP19A1 RDH8,11,estrogen biosynthetic process,HSD17B12 HSD3B1 HSD17B1 RDH8 HSD17B8 ZIC1 CERS2 KIF3A COQ8B VDR DPYD,ABCG8 TMPRSS13 IGFBP3 OR52D1 TMEM25 FGF7 INHBC SCARF1 BAG3 COMMD3-BMI1 JPH1
GO:0070294,SGK1 CLCNKB OXSR1 UMOD KCNQ1 EDNRA SLC12A3 EDN1 KLHL3 MAGED2 WNK4 EDNRB STK39,13,renal sodium ion absorption,EDNRA OXSR1 CLCNKB MAGED2 KLHL3 EDN1 MAB21L1 CSK UBE3B CD200 RTP3 NF2 AVEN,GINS4 TAP1 TOM1 SPAAR RIGI BMP2K GCG MST1R DUSP4 SERPINA6 TRUB2 SERPINA9 TMBIM6
GO:0005976,PRKAG2 GCK AGL PYGB NDST1 ACADM ADCY10 ENPP1 IGF2 GYG1 GBE1 GYG2 EGF NR1D1 GNMT PPP1R3D AKT1 PPP1R3B CHST7 PGM2 GCGR UGP2 PASK PFKM EXT2 PER2 PHKB CLTC G6PC1 AKT2 GAA PPP1R3G STBD1 NDST3 IGF1 CSGALNACT2 PCDH12 PPP1R1A GSK3B PYGM GSK3A GYS1 INSR SELENOS CHST1 PRKAG3 INPP5K PPP1R3A PPP1CC PYGL PPP1CA NDST4 CSGALNACT1 NDST2 PPP1R3E EXT1 RUBCNL PHLDA2 PHKA1 IL6ST FUT9 PTGES3 IRS2 PDGFB CHIA AP2A1 PHKA2 PTH PPP1R3F INS HS2ST1 PHKG2 MGAM NFKB1 TGFB1 SORBS1 DYRK2 PPP1R3C POMC IRS1 SMPD3 STK40 CHIT1 EPM2AIP1 PPP1CB NHLRC1 KHK GYS2 HAS3 LEPR PHKG1 HAS1 HAS2 PPP1R2 NPC1,95,polysaccharide metabolic process,NHLRC1 HAS1 ENPP1 EXT2 NDST2 PPP1CC SELENOS IGF2 INS PHLDA2 INSR POMC PPP1R3B PYGM PASK GCK PYGB MGAM SORBS1 GBE1 NPC1 PPP1R3F PPP1R3A GYG1 CHIA EPM2AIP1 ACADM PPP1R2 GNMT PFKM PPP1R3D CLTC CSGALNACT1 IRS2 IL6ST PHKA1 GSK3B LEPR FUT9 PHKB PHKG2 PER2 PHKG1 STBD1 UGP2 NR1D1 DYRK2 SLC36A2 TECRL ADGRD1 VSTM1 MNS1 TPRG1L OR6C75 ABHD15 AFM CDS2 BBS9 ARHGAP29 INPP4B METRN RHOBTB2 HTR3E MAP6D1 TRPV6 SLC35A5 DBH IFT81 LRRC8D OLFM2 NRAS SLC35F4 NCAPG SHOC2 OR2L5 CSE1L SLCO1B1 TXNDC12 MSMB OR2F1 NPAP1 NLRP8 OR1J4 SLC15A5 KIF21B LRRC17 FSTL1 HBM MFRP CLCN2 KIR3DL1 CYP2A7 MAMDC4 TSPY10 XKR5,DGCR6 SNX4 CD63 LGALS16 OR2T6 NUBPL ATG2A COX6B2 OR1D2 NEK9 RNASE13 CRHR2 SMPDL3B FYB2 NLE1 FAM171A1 GSTM1 SPACA6 PET117 OR2T29 CD1B GUCA1ANB-GUCA1A IMPG2 DHODH TMEM74 MYO1B UPP1 PEX7 AP5M1 GSTT2B HADH RACGAP1 SPATA33 TBC1D3L NKAIN1 SLC25A32 ADH7 TPMT LRFN5 PTPN20 RFLNA ADISSP CHRND SUN5 MXRA8 GPX4 FADS2 PCDHGA11 GHDC TMEM150A PARVA H2BC3 OR52N1 RGS5 ATP5MC3 OR51V1 CEP76 PDE6C CYP3A4 TBC1D19 CEACAM8 KCNH1 ARL17A KLRC2 OR11H2 NDRG3 OR6N1 TEX2 RTP2 SLC25A25 HLA-DRB3 KCNE4 TPM4 BROX DST CHRFAM7A PRRG3 GAB2 WDR7 SLC25A48 IGFBPL1 TNFAIP8 KIF1A TBC1D8 LRRC55 PLA2G12B OR2T1 MEMO1 MYH4 PEX11B DAAM1 MPP4 TAC3 VSIG2 OSTF1
GO:0002711,CD1D DENND1B ARID5A PVR CD1B RAET1L TRAF6 MR1 ZBTB1 IL23A RAET1E FBXO38 NLRP3 XCL1 TRAF2 HLA-C TAP2 ZP3 IL18 B2M SLC22A13 TBX21 CD1C HSPD1 IL4 IL12RB1 IL1R1 MICB MAP3K7 MALT1 PRKCZ TNFSF4 CYRIB NECTIN2 CD81 HLA-E HLA-DRB3 HLA-DRB1 HLA-DRA P2RX7 STX7 FADD IL1B MICA CD1A ULBP2 CD55 HLA-A HLA-B FZD5 IL6 PTPRC IL12B FOXP3 HLA-G HFE ULBP1 SASH3 GATA3 IL23R SLAMF1 ULBP3 RAET1G IL18R1 CD1E HLA-F RSAD2 IL12A,68,positive regulation of T cell mediated immunity,ZP3 CD55 PTPRC FOXP3 GATA3 PVR ULBP2 IL18R1 SLC22A13 FADD TAP2 ARID5A HSPD1 CD1C NECTIN2 FBXO38 TNFSF4 HLA-C NLRP3 IL12A RAET1L SASH3 CD1D B2M TBX21 P2RX7 CD1B IL23A CD1E SLAMF1 IL6 RSAD2 ULBP1 HFE GTF2H4 OLFML2B KDM4D THSD7A DNAAF11 TFDP3 TLX1 GGT1 CATSPER2 ELL3 MUL1 FITM1 GTF2H2 CIC PSMD6 SPATA31A6 SLC35E2B EIF5AL1 CSAD METRN SHISA2 PPP1R3F TAPBP POLR3F FBXO31 INO80B EIF3E OR4C5 CATSPER4 ZNF607 CTSK GPD1 THAP12 CPE,KLHL9 OR8D2 RAB8A ATPAF1 ID4 MAPK8 RNASE6 CDHR3 MAU2 DHPS QTRT1 OR4D2 METTL25B VSTM1 HAP1 ORM2 XYLT1 NCAM2 CBX3 PHKA1 CACNB3 CTU1 BROX DEFB107A ATG9B C15orf62 ZNF429 KCNIP3 ZNF208 PRB2 SETD1A MSRA ERVW-1 HTR1F SAGE1 LRWD1 TAS1R3 RALBP1 PDRG1 C8A CSF2RA SFXN3 ZCWPW1 ACTG1 KPNA7 HCAR2 ITFG2 NRF1 PIK3C2B UBE2V1 MTA3 GAL3ST1 PPP1R14B SPDYC NUDC UNC45B OR5B17 PSMA2 HSD11B1 HGFAC ALG14 CST9L RPL14 FIP1L1 FASTKD5 HSPA1L MTPAP GNRH1
GO:0042073,LCA5L CCDC38 IFT22 WDR19 CILK1 IFT43 TUB TTC21A LCA5 IFT80 IFT46 IFT122 ARL3 IFT140 CLUAP1 DAW1 IFT70A RPGR IFT70B TRAF3IP1 DYNC2LI1 IFT25 SSX2IP DYNC2H1 IFT20 BBS12 RABL2B DYNLL1 IFT172 IFT81 WDPCP TTC21B IFT88 IFT52 SSNA1 MAK DYNC2I1 WDR35 INTU CEP131 IFT57 FUZ IFT56 KIF3B PCM1 IFT27 DYNLT2B IFT74 DYNC2I2,49,intraciliary transport,TTC21B DYNLT2B DYNC2I2 IFT52 CLUAP1 TRAF3IP1 IFT46 IFT22 IFT56 INTU IFT20 IFT70B MAK IFT27 TTC21A LCA5 IFT70A RPGR IFT80 CILK1 SSNA1 DYNC2LI1 IFT43 IFT25 CLCN5 CENATAC POLR1E PCDHGA10 OSGEPL1 ATG4A USP17L25 EXTL3 AASS GPR155 PLCL2 GLMN EEF1A1 MAP3K11 AGRN TMEM170A CUX1 MTRES1 COL6A2 CD300A NUDT18 GPR75 WNT8A CNTNAP5 GJA9,PPP1R12A TEK JMJD4 NYX PCDHB2 AGXT2 EME2 RSF1 HNRNPH3 UBE3B MRPS2 MT2A HSF5 LAT2 NFYB STK3 RAB11FIP4 SMAD9 OR2T12 SOX30 BPIFB1 TSPY10 SMYD1 MMAB CD36 NGLY1 RPL13 NRDC CNST TMSB15A GLRA2 HOXA10 PCDHA13 NOTCH2NLA ZNF763 DENND2B GJB4 TACO1 SYT7 CDKN1A TENT4A EPHA1 DNAJB14 CORO2A MXD4 FABP2 PLXND1 STAB1 OR2M3
GO:0002727,HLA-E CD226 HLA-G CLNK RAET1G CD160 KIR2DL4 HLA-F CD96,9,regulation of natural killer cell cytokine production,KIR2DL4 CD96 HLA-G CD226 OSGEP METTL14 CNEP1R1 GALT G6PC2,ZIC4 PPP4R3A CD4 DDIT3 ATG14 SSR2 MKKS GDPD1 THOC2
GO:0060528,WDR77 FOXA1 NOTCH1,3,secretory columnal luminar epithelial cell differentiation involved in prostate glandular acinus development,WDR77 OR7C1 MIPEP,KCNK13 ZNF33A OR8K5
GO:2001198,TMEM176A LILRB2 HMGB1 LGALS9 CEBPB LGALS3 HLA-G LGALS1 AGER FCGR2B LILRB1 TMEM176B ZBTB46 HLA-B,14,regulation of dendritic cell differentiation,FCGR2B HMGB1 LGALS9 HLA-B LILRB2 CEBPB ZBTB46 HUNK DDX11 ZNF264 GTF2I AJM1 HDAC11 INCENP,COPZ1 RHBG TNFAIP2 OVCA2 RARG OXT ZNF404 NPFFR2 TRAK1 SLC2A4RG GTF2IRD1 CD84 AHRR TSTD2
GO:1905668,ABHD17C ABHD17A RDX ROCK2 EZR DTX3L EGF MSN ABHD17B MGAT3 NF2 SORL1,12,positive regulation of protein localization to endosome,DTX3L ABHD17A ABHD17C EGF RDX EZR NECAP1 PSMD14 VTI1B IQCH FTH1 CD101,LETM1 RUFY1 IL1RAPL1 SETX POLR2L EPX ZCCHC3 GSX1 GADD45GIP1 RCN3 DNAI4 EPHA1
GO:0046514,ASAH1 HEXA HEXB ACER2 GBA1 NEU4 GM2A PRKCD ASAH2B GLA GBA2 NEU1 ASAH2 NEU2 GALC ACER1 NEU3 ACER3 LCT GBA3,20,ceramide catabolic process,ACER2 ACER3 NEU2 GM2A ASAH1 HEXA LCT GBA2 NEU4 HEXB TPBGL CD300LF MOV10 IPO9 KPNA3 IP6K1 N6AMT1 FCRL1 SOS2 PDCD5,H2AB1 MRPL38 GLTP GTF3C4 TTC5 RTF2 ATP5MC2 ACOT13 TRAF5 ACSL6 CHRD COL10A1 DHRS4L2 CXCL12 CCDC68 OR6S1 RWDD1 RNF103-CHMP3 HDGFL2 CLEC12A
GO:2001187,HLA-E CBFB XCL1 NCKAP1L LILRB4 RUNX3 HLA-A RUNX1,8,"positive regulation of CD8-positive, alpha-beta T cell activation",XCL1 LILRB4 RUNX1 RUNX3 INSIG1 CHRM5 EFEMP1 LAIR1,P4HB ABI2 PCDHGB6 SLC10A4 UACA ZNF317 USP9X SELENOM
GO:0001881,PTPN1 EPS15 ANXA2 NSG1 PEX1 CHMP5 PEX2 ARAP1 PHETA1 NSF ALS2 TRAT1 LAMTOR1 AP1AR RAMP3 TBC1D16 LDLR EHD3 USP9X PEX12 PEX5 REP15 ARFGEF2 RAB11B PTPN2 CAMLG ECE1 SCRIB PEX6 LMTK2 SNCA RAB29 CTSD GRIA1 VAMP3 PLEKHJ1 INPP5F ACHE KIF16B PSEN1 PLEKHA3 PCSK9 OPTN SORL1 BVES PEX10 PHETA2,47,receptor recycling,PEX5 ECE1 EHD3 ARAP1 AP1AR GRIA1 NSG1 TRAT1 LAMTOR1 PLEKHJ1 PCSK9 ALS2 PEX2 REP15 INPP5F KIF16B PEX12 PEX1 ACHE CTSD PTPN2 NSF PLEKHA3 MEIKIN TMEM259 SNRPA1 ABI3 POMP LY75-CD302 EYS CARNS1 TNFRSF11A RBP2 OR52I1 SURF4 TAS2R42 GPX8 DNAL1 CASP2 CELSR3 HRH3 CRTAP FITM2 PRKD3 EVX1 LRRN2 ZNF277,POU4F1 USP17L13 ZNF735 RPS6KB2 AZGP1 PCK2 GDPD2 FOXK1 ATP1B4 IK KAT7 F13A1 DEPDC1B TRIP6 RPL10A STAG2 NFE2L2 LTBR PGAP4 DEFB4B VSTM2L PGLS FSTL5 MAK G6PC2 OR52N4 PABPC1 YPEL3 TMEM175 WHRN LENEP TNFSF13B ZNF207 MYH4 RALGAPA2 EXOSC3 TRIM77 ITGB7 SMPX DMRT1 ALKBH8 KIAA1586 ZNF426 MRPS24 HS3ST3A1 CPS1 MED31
GO:0000380,SFPQ KHDRBS2 SLU7 KHDRBS3 HNRNPA1 SRSF2 NOVA1 SRSF1 WTAP STRAP TRA2B FMR1 RBFOX2 SRSF9 REST NCBP1 RBM17 RBFOX3 RNPS1 PQBP1 CDK13 CELF6 THRAP3 RBM7 RBM8A CELF2 HNRNPU CELF3 RBFOX1 HNRNPM RBM25 SRSF12 KDM1A NCBP2 RBM47 DDX5 RBM15 HNRNPUL2 HNRNPUL1 TNFAIP8L2-SCNM1 SRRM4 SAP18 MYOD1 TIA1 HNRNPL RBM5 MAGOH DDX17 CELF4 SFSWAP YTHDC1 RBM4 NOVA2 RSRC1 ESRP2 ZBTB7A PTBP1 RBMX NSRP1 SMU1 RBM24 SCNM1 DHX9 RBM11 CELF5 SRSF6 PUF60 RBM20 KHDRBS1 RBM15B RBMY1A1 ARB2A CELF1,73,"alternative mRNA splicing, via spliceosome",HNRNPA1 SLU7 RBM7 RSRC1 HNRNPM SRSF9 HNRNPU SFSWAP TNFAIP8L2-SCNM1 KHDRBS2 SRRM4 SRSF2 REST RBM11 NCBP2 ARB2A RBFOX3 MAGOH MYOD1 NOVA1 RBM4 DDX5 WTAP HNRNPUL2 RBM17 SAP18 KHDRBS3 RBMX RBM20 STRAP KDM1A RBM15B RBM15 CELF4 SRSF1 RBM25 DMAC2 A4GNT NR4A1 INPP5K CHPF ZNF799 RAD9B FABP3 ATG16L1 HMCN1 PLEKHN1 RARA OR13C3 PYGL TRIM6 RAB4A MLLT11 ZNF737 CD1B ALG5 UQCC3 IDNK TIMM8A DNAH9 MYO1G CTU2 VCY1B MEGF9 NRDE2 PCNP NUDC NDST3 TRIM33 THAP5 BRAT1 PALS1 PLEKHO1,RASAL2 GPT2 QARS1 SPTBN4 ZZEF1 HOXB5 OR5T1 MANF AMY2B PDCD6 RAC3 SLC2A8 RCL1 ABCA3 ALOX12 NCOA7 SCAND3 AFG1L ALKBH8 MARCHF8 GRN SLC15A5 ADD3 SETD2 BTG2 RNASEH2C CTNND1 OR2Z1 KDELR3 PGLS H2AC12 ZBTB12 GPR139 ABTB2 SPINT1 IL1RAPL2 SLC1A6 IKZF1 KSR2 AGT TET2 SPEF1 APH1A YRDC CD207 TNFRSF10A OR10C1 RIPOR2 BATF RAD21L1 UTP15 AMN1 PARG MMEL1 INTS5 ZNF586 DNPEP RGPD4 ZNF304 METTL4 CTSL NDUFV2 LSG1 NEUROG2 LBR WNT7A RASSF3 E2F4 MS4A15 P2RY6 GRIP2 RNASE8 NXF2
GO:0001682,RPP25L POP4 RPP40 PRORP POP5 POP1 RPP25 RPP38 SSB RPP30 RPP14 RPP21 POP7,13,tRNA 5'-leader removal,POP4 RPP40 POP7 SSB POP5 PRORP TFDP1 SUPT16H VSIR VPS29 DYNC2I2 CRYBA1 GPR89A,GARIN4 RTKN2 INTS1 SLC26A3 AWAT1 SLC37A4 PPIH OTULIN PIGH LAIR1 KPNA2 IMPACT TP63
GO:0097120,IQSEC2 KIF17 GPHN CEP112 NSG1 RAPSN GRIP2 GRIP1 SHISA6 CACNG8 C1QL3 TYROBP GRIPAP1 GHSR ERBB4 DAG1 RAP1A CACNG3 LHFPL4 VPS35 DLG4 DLG2 DLG1 RELN TAMALIN STX3 PRKCZ KIF5B STX1B NETO1 DLG3 KIF5C NLGN1 SCRIB STX7 NETO2 CACNG5 CACNG4 OGT SNAP25 CACNG2 ZDHHC3 GPC6 DBN1 RAB11A LGI1 NPTX1 CACNG7 ADAM10 CLSTN1 RAB8A CPLX1 HRAS KIF3B KIF5A ERBB2 C1QL2 ARHGAP44 GPC4 ITGB3 NPTN,61,receptor localization to synapse,CACNG2 ZDHHC3 OGT GRIP2 DAG1 TYROBP NLGN1 NSG1 GRIP1 RAP1A KIF5A DLG2 NETO2 NPTX1 ADAM10 HRAS CEP112 LGI1 LHFPL4 SNAP25 KIF17 RAB8A STX3 NPTN CPLX1 SCRIB VPS35 GPC4 ITGB3 PRKCZ PAPOLG STK17A PCDHGB7 OASL SLIT3 USP25 DAB2 OXSR1 H3C6 NCSTN TMT1B ERVFC1 FBXO2 WNT5B FABP5 UCHL3 SPATA20 SLC17A6 RC3H2 TRPM8 PARP16 DHODH GPR39 GOPC AMZ2 UGT2B7 SLC15A4 PRSS58 ADORA2A OGDHL SPOP,SLC2A10 NTMT2 KDM7A UTS2R CACHD1 TRIM35 AQP10 SLCO2B1 IARS2 UBE2E3 GTF2IRD1 COX7B ASGR1 TNS3 BACE2 MPND KCTD20 POGLUT1 SLC26A2 ITGB1BP2 CKLF DUSP18 NUDT13 COG6 CAVIN4 CENPW ACBD3 PVRIG PAX1 PDCD10 FEM1A FREM1 ZBTB16 CDK3 SIDT2 UNC13D PABPN1 TVP23A ORMDL1 PCDHB13 DDHD2 FAM9B UBE2V2 VDAC2 LSM3 TIMP1 RAB24 FMO4 DNAAF6 HIVEP1 CHRNB2 ENTPD7 KIF14 LGI3 FNIP1 PKN2 ATP2B4 ALG3 GPR152 NFIC IRS2
GO:0071611,ISL1 CD34 HAVCR2 TSLP LILRA2,5,granulocyte colony-stimulating factor production,HAVCR2 TSLP NRGN LGALS7B TST,P2RX3 NIPAL4 ABCA10 NTAN1 TUBB3
GO:1903679,NCK1 YTHDF2 METTL3,3,positive regulation of cap-independent translational initiation,METTL3 SALL4 FGFBP3,PCSK1 AFMID TDRD5
GO:1901079,CHGA ABCC8 HRC,3,positive regulation of relaxation of muscle,ABCC8 TBCB LATS1,SSX7 ZNF425 RTP4
GO:0030208,DSE CHST12 UST CHST14 DSEL,5,dermatan sulfate biosynthetic process,DSE CHST14 TPRG1L UQCRH LRRC41,TNFRSF19 DAXX NFKBIA TSPAN10 DRG2
GO:0001834,ZPR1 IGF1 COPS2 ACVR1C,4,trophectodermal cell proliferation,ZPR1 COPS2 CBX3 TAS2R4,NRIP1 SPSB4 MND1 SLCO1C1
GO:0045723,NR1H2 KAT2B APOA5 LPGAT1 APOA4 MID1IP1 CD74 SLC45A3 ELOVL5 SIRT2 NR1H3 AVP ABCD1 RGN ABCD2 PTGS2 APOC2 IL1B PLA2G3 MLXIPL AVPR1A,21,positive regulation of fatty acid biosynthetic process,ELOVL5 SIRT2 LPGAT1 AVPR1A APOA5 MLXIPL PLA2G3 AVP MID1IP1 APOA4 FANCA CEP41 ZNF560 CYP51A1 CRHR2 CACNA2D2 TMC1 RAB35 PYDC5 ZNF599 APCS,ZNF512 LRAT B9D1 CRHR1 SEPTIN10 TMEM245 MTNR1A IZUMO1R LOXL2 TMBIM1 VIPR1 NONO FAM47E-STBD1 ZNF286A AMIGO1 GDF10 L3MBTL1 RBM25 CGREF1 OR2H2 IVNS1ABP
GO:0090183,PAX8 WNT4 BASP1 GDNF SOX9 TACSTD2 GREM1 HNF1B LGR4 MAGED1 STAT1 WT1 SIX2 EZH2 NOG VEGFA OSR1 AGTR2 SIX1 FOXD1 HOXB7 SIX4 ADIPOQ AGT WNT2B PPP3CA PAX2 LHX1 GATA3 MYC BMP4 SOX8 SMO RET,34,regulation of kidney development,NOG VEGFA WNT2B LGR4 GREM1 SIX2 WNT4 PAX2 FOXD1 GATA3 SOX8 WT1 ADIPOQ MAGED1 AGTR2 BASP1 PPP3CA ADAM15 JRKL MGAT5B SCAF4 TLE4 UQCRHL CATSPERZ TRAF3 SUMO4 FHL3 OR11H1 C1GALT1C1L ATAD3A ZNF45 MLST8 BCL2L2 MYH1,WWOX TMEM125 RPH3AL MRPL15 CENPM NR2F1 HCFC2 KRT20 GRM2 RGL3 FPR3 SFT2D3 GRHPR P2RY8 NLRP9 APBB1IP ACTL7B HERPUD2 RPS6KA2 MFSD4A M6PR ZDHHC11 KRT12 RNF213 A3GALT2 HRH1 CCNI HOXC4 BBS10 OR2B2 MMP10 IMPG1 NINJ2 ZFP69
GO:0034342,IFNLR1 IFNG IFNGR1 SHFL IFNL4 IFNL1 IFNL2 TYK2 IFNL3 IL10RB JAK1 IFNGR2,12,response to type III interferon,IFNGR1 JAK1 IFNL2 TYK2 IL10RB IFNL3 TGIF2 CYP11B2 CHPF2 POTEE CEMIP2 UMODL1,TYMP SMG9 BTG1 CTDSPL2 STPG1 TMCO1 PDCD1 VPS11 OR2D2 CCT6A SLC66A1 CRMP1
GO:0000429,KAT2B MLXIPL USF1 FOXA2 OGT NCOA1 USF2,7,carbon catabolite regulation of transcription from RNA polymerase II promoter,MLXIPL NCOA1 KAT2B METTL1 PIEZO1 RBM27 PLPP4,DZIP1L ACP3 ORMDL1 CYTH2 ATAD3B CLIP1 RALGPS2
