GO,Genes,Gene_Count,Term_Description,50perc_contaminated_Genes,100perc_contaminated_Genes
GO:0009119,UPP2 NT5C1B APOBEC3B ADAL UPP1 ADK ICMT ADA APOBEC2 XDH APOBEC3H MTAP APOBEC3A GNMT APRT APOBEC3F NT5C2 APOBEC3C DGUOK CDADC1 PNP APOBEC3A_B ADA2 APOBEC1 ACP3 NT5C1A PRTFDC1 ENPP4 CDA PGM2 NT5E PTGDR HPRT1 APOBEC3G NT5C1B-RDH14 AICDA,36,ribonucleoside metabolic process,ADAL GNMT PRTFDC1 ACP3 AICDA UPP2 MTAP APOBEC3A UPP1 NT5C1B-RDH14 PNP APOBEC3C ADK CDADC1 APOBEC3G ENPP4 ADA PTGDR KLK2 OR5F1 GLYATL1 CNEP1R1 MISP MEIOB OASL STARD8 TMEM174 PDGFRA ESYT3 ZFP36 SNRPG ZFP92 KIF27 RAB27B GALP FAM86B1,TRAM1L1 HS2ST1 PARP8 RNF138 TCF7 RNF217 ZNF671 ITPA TP63 SERPINB5 ABCA10 PM20D1 DGLUCY METTL17 GPRC5B PDE4C AKR1D1 CENPH CD302 APEX1 ZNF792 MRM1 THEM4 BHMT CSRP1 BMP5 NME7 SIDT2 IQCN EBF2 DCPS APOE OC90 BRCA2 ZNF335 HOXC5
GO:0140447,CMA1 CASP1 FURIN PCSK5,4,cytokine precursor processing,CMA1 CASP1 GCM1 RCN1,SRM NADK2 ARAP3 BEST4
GO:0021511,LHX3 GLI3 INTU SOX1 DBX1 DLL4 GDF11 SHH RELN SMO ASCL1 FOXN4 SUFU NKX2-2 DMRT3 GLI2 CHRD IFT122,18,spinal cord patterning,SMO IFT122 SHH SOX1 RELN DLL4 INTU GLI2 SUFU AMY2B TIMM22 CRTC2 RYR2 GMCL1 CA14 ZIM3 CEACAM8 MNAT1,CENPQ PPP1R15B TAS2R5 NDUFAF7 DNTT ASH1L MTG1 COX10 MFSD1 ITGA11 WFDC13 TFAP2A SLC29A2 PSG9 GBP4 SLC25A36 ZNF652 BLVRA
GO:0034136,LYN NOD2 TLR6 TNFAIP3 TREM2 ACOD1 MFHAS1,7,negative regulation of toll-like receptor 2 signaling pathway,TLR6 MFHAS1 ACOD1 ARSL PSMD9 TRIM13 GALNT3,NANOS2 GCNT1 GLTP GRIA4 GP9 M6PR CD163
GO:0070269,CASP4 ZBP1 PYCARD GSDMB TRIM21 TREM2 GBP3 DPP9 GSDME ELANE AIM2 CASP8 NLRP3 MEFV GSDMA CASP6 GBP5 APIP GBP2 CASP1 MAP3K20 NINJ1 GZMB NLRP1 NLRC4 GBP1 ZEB2 CASP3 GSDMC GZMA NAIP DHX9 IFI27 GSDMD NLRP9 NLRP6,36,pyroptosis,NLRP6 GSDMA GSDME NLRP9 MEFV NINJ1 TREM2 CASP4 GSDMD GBP1 IFI27 CASP8 GBP3 GZMB CASP6 NAIP ZEB2 MAP3K20 CA3 RTP1 OR10P1 ST14 VSIG4 MALSU1 SFT2D2 PIP4P1 ACVR2A ARHGEF18 FGFBP2 CHTF18 DUSP7 UPP1 TBXAS1 SLC6A7 ADARB2 PWP2,PARVA DESI1 SPACA6 DEFA6 GRAMD1B OAS3 UBE2D2 GCNT1 ARHGEF15 ZNF559-ZNF177 RAD51B ERVH48-1 RBMY1J SYNJ1 CDNF TMEM53 POTEI SIRPB1 ARHGEF40 OR5B21 ATP8B2 MOB3A CTAGE1 SPCS3 ALDH2 TRMT12 SNX15 KRT10 LIN7B OR4B1 GPC3 BPIFA1 CRACR2A GCA SOAT2 NIM1K
GO:0021855,FOXB1 NDNF NRP1 NRP2 SEMA3E PLXNA1 PLXNA3,7,hypothalamus cell migration,PLXNA1 NRP1 FOXB1 OST4 XKR4 TFDP2 PPP2R3B,NYAP2 ANAPC5 PLA2G4F BCO2 PRRT2 LCN1 DPY19L4
GO:1903226,MACROH2A1 SOX17 MAP2K1,3,positive regulation of endodermal cell differentiation,SOX17 SIDT1 ZNF33B,CSN3 CRIPTO RGPD6
GO:0046100,HPRT1 PRPS1 XDH ADA,4,hypoxanthine metabolic process,XDH ADA RAB35 APOC4,WDR11 PBX1 SLC25A15 ZNF75A
GO:0031342,GFER LILRB1 KLRD1 LGALS9 PPP3CB SERPINB4 HAVCR2 CLEC12B IL4 KIR2DL4 CX3CR1 HLA-E IL13 ARRB2 MICA SERPINB9 HLA-A HLA-B CRK PTPRC CR1 HLA-G IL7R CEACAM1 FCGR2B KLRC1 TGFB1 HLA-F NCKAP1L,29,negative regulation of cell killing,LGALS9 MICA PTPRC HLA-E CX3CR1 TGFB1 SERPINB9 IL4 SERPINB4 HLA-G LILRB1 PPP3CB KIR2DL4 HLA-F TIMM8A MRPS15 RAB28 OOSP2 KRT13 TAAR6 NMUR1 HECTD3 PCDHGB1 LRTM1 GPKOW HAUS4 LIPF IL22 C2CD6,MGST3 OR2B6 CDK11A NAA11 TYMP ALAS2 SDC1 HSFY2 SH3GLB1 ECSCR IKBIP BORCS5 MIS18A CBLL2 POU4F3 FETUB TF VCY LIPJ CDC123 CPN1 ALKAL2 SERF1B ADRA1B CYP2J2 USP17L30 MIGA1 CAMSAP1 SPRR2E
GO:0051966,CACNG8 DGKI DKK1 FXR1 GRIK3 DGKZ SERPINE2 ADORA2A GRM3 PTGS2 GRM7 FRRS1L CDK5 SYT1 GRIK2 NPS DTNBP1 GRIN2B HDAC6 MAPK8IP2 IQSEC2 GRIN1 DISC1 DRD3 GRIN2A GRIK1 CACNG3 GRM5 CCL2 TNR TNF RAB3GAP1 GRM1 GRM2 UCN CACNG4 DRD2 CACNG2 CDH2 PTK2B GRM8 ATAD1 STXBP1 TSHZ3 SLC38A2 NTRK1 GRM4 TPRG1L CCR2 DRD1 LRRK2 UNC13A KMO ATP1A2 MEF2C CACNG5 PLPPR4 CNR1 PSEN1 OXTR GRIN2D HOMER1 ROR2 HTR2A GRIN2C NLGN2 RNF167 RELN OPHN1 NLGN3 HTR1B NLGN1 NRXN1 CACNG7 ADORA1 GRM6 CLN3 EGFR,78,"regulation of synaptic transmission, glutamatergic",ROR2 TPRG1L GRM1 NRXN1 CDH2 MAPK8IP2 HTR2A CACNG5 RNF167 TNF GRIN2B CACNG4 GRM5 CCR2 CACNG7 SLC38A2 CACNG2 UCN RELN PSEN1 GRM6 GRIN2A DGKZ SERPINE2 FRRS1L ADORA2A MEF2C CACNG8 GRIN2D CNR1 CDK5 TNR PLPPR4 OXTR GRIN2C GRM8 HTR1B GRM4 CCL2 GANAB ZNF610 LMO3 PHYH SIGLEC7 MAD2L1 NLRC3 TTLL5 DDO SLC5A6 RNF157 EIF4E2 CYP21A2 RBM41 BCAS2 CCNP CXCL12 GRB7 CHRNE FBXL13 PTCH1 PCDH7 LETMD1 EMSY SIGLEC1 CEACAM19 RNF169 IL16 GCSH KCTD19 SLC6A11 TBX10 ITIH5 TRAF5 WASHC2C HSPA1A VCPKMT PGBD1 NADK2,TLE1 OR4F21 IFNA13 TAF6 SYCE1L PRKRIP1 INTS1 PLBD2 CRABP2 ZNF382 CPNE4 ALDH4A1 MRS2 EDIL3 INSM1 FTCD RBMY1E MID2 PP2D1 ZC3H12D DNAJC30 PDE12 FEN1 TMEM86A DIO2 ZCCHC4 FANCB NOP2 TOR1B MYORG NPM1 ATG10 MRPS9 ZMIZ1 SERPINA6 MEGF10 CA6 FAN1 NPBWR2 NANOG SFRP5 NECAB2 SGSM2 H2AC6 MPI LZIC HLA-A THOP1 GPR176 MAP3K5 RABL3 HYCC2 C2 MTERF3 PRDX1 MARCHF7 PLPP6 SETD6 CDX2 COX7B2 ANKRD26 JMJD7 SLC10A2 PAGE4 MSMO1 ZNF267 ZNF583 ZNF69 CYP2A7 ZNF148 TMEM45B CENPV TAS2R31 RPLP1 SFTPC PLEKHA5 CRACD RSPH6A
GO:0061713,GRHL2 CASP3 FOLR1,3,anterior neural tube closure,GRHL2 HNRNPUL1 RIMOC1,IL2 HNRNPLL ZNF35
GO:1902775,FASTKD2 DDX28 DHX30 MRM2,4,mitochondrial large ribosomal subunit assembly,MRM2 DHX30 MEA1 CDC37L1,MTMR9 AICDA TOMM7 RETREG2
GO:1900047,ANXA2 SERPING1 TFPI THBS1 PROS1 SERPINE1 FGA VTN FAP KNG1 SERPINB2 APOE PRKCD ADAMTS18 PLAU COMP USF1 PDGFRA PROC PLAT ADTRP FGB PLAUR EDN1 SERPINE2 APOH PDGFB TSPAN8 GP1BA F2 SH2B3 NOS3 ALOX12 F12 CD9 SERPINF2 KLKB1 CPB2 UBASH3B F11 PRKG1 THBD CEACAM1 C1QTNF1 FGG PDGFA KRT1 PLG HRG TMX1,50,negative regulation of hemostasis,F11 PRKCD TFPI APOH SERPINE1 C1QTNF1 ADTRP USF1 PDGFA FGA PLG FGB ALOX12 SERPINF2 PRKG1 CEACAM1 F2 PLAU PDGFB EDN1 KRT1 PDGFRA GP1BA UBASH3B CD9 OR5I1 ZMYM3 RBM11 CHAT RAD23A FLRT2 RBM26 CCT4 ATP2B2 HADHB PSAP PPIAL4E PCDHA11 MPP4 TMEM63A POU5F1B AP2A2 GNG3 USP48 RGL1 PSMB1 RAB39B EIF3M MBD5 NVL,SUOX METRN KSR1 SAMD8 RPAIN GSTO2 SDF2 IPMK AKAP5 EPB42 OR12D2 LUZP1 REEP3 LAMB3 RTCB SYNE2 OTX2 ITGB4 GOLM1 H2AC7 TRMO PRKACG TAS2R14 RTF2 PTPRCAP STAB2 ALG10B GGTLC1 ZNF567 CLCN7 PSMC2 SNAPC2 TMEM97 CHTF18 IMMP1L OR1L6 SGMS1 ARHGEF26 CENPN OR51B5 LRRC4 RAD21L1 EXOC3L4 CPLX4 DPH2 XPR1 EPHA5 SOHLH1 MFSD4A SLC35D2
GO:0015701,SLC4A8 SLC26A1 SLC4A4 SLC39A14 BEST1 SLC4A3 CYB5R2 SLC39A8 SLC4A10 SLC26A6 CYB5R1 SLC39A4 CFTR SLC39A10 SLC26A3 SLC26A2 SLC39A5 CYB5RL SLC26A4 SLC26A7 RHAG SLC4A9 SLC4A1 CA4 SLC39A6 CYB5R4 SLC4A11 SLC4A5 SLC4A2 SLC26A8 SLC26A9 SLC39A12 SLC26A5 SLC4A7,34,bicarbonate transport,SLC4A9 CYB5RL CYB5R1 RHAG SLC26A1 SLC4A11 SLC4A5 SLC39A14 SLC39A4 SLC39A10 CYB5R4 SLC39A12 SLC39A8 CA4 SLC26A5 CFTR SLC39A6 ZNF213 TUBA1B NEUROD6 RALGAPA1 ZNF705D BMI1 OR6C6 TMEM54 CPLX2 RHO DAXX APOC2 SF3B2 PSENEN ATP6V0E2 G2E3 CDSN,OR4K15 TNFRSF18 BROX SLC22A5 GPR183 SLC40A1 CCDC68 SERPINA12 NSA2 PHF23 RHBDL3 FAM170B KLHL4 KLK7 SEPTIN2 ZNF561 TXNDC16 USP50 RDH14 RAP1A CDK9 BAG6 OR10V1 H2AP GPR63 RPL36A MT1M OSGEP INTS10 WNT8A RB1CC1 HTR3A ATP1A4 ZNF256
GO:0010757,PLAU CTSZ THBS1 SERPINF2 SERPINE1 SERPINE2 CPB2 PLAT,8,negative regulation of plasminogen activation,CPB2 SERPINE1 PLAU THBS1 ZNF737 SMDT1 XPNPEP2 LRRC32,ADAMTS17 CEP63 LRRC18 SUPT3H FUBP1 KCNK4 RPL27A LRWD1
GO:1902083,NCOA7 ATP2B4 SNTA1 OXR1 DMD TBC1D24,6,negative regulation of peptidyl-cysteine S-nitrosylation,DMD OXR1 NCOA7 KPNA5 HNRNPH2 ANKRD40,SP140L ZFP92 PVALB ACYP2 FBLN7 KCNJ6
GO:1901535,TOX HNRNPAB A1CF DPPA3 APOBEC1 STPG1 STPG4 GATA3 USP9X USP7 OTUD4 TRIM28,12,regulation of DNA demethylation,USP9X TRIM28 STPG4 GATA3 A1CF HNRNPAB PCDH11Y TRIM54 PI4K2A RBM14-RBM4 SCOC DEPDC7,ABCC4 ZFP69B LMTK2 LNPEP CYP11A1 KRT75 CPEB3 UNC13A SPTY2D1 NUP214 DPPA2 FOXE1
GO:2000136,GNG5 TBX5 ISL1 RBPJ CTNNB1 NOTCH1 SMAD4 EYA1 BMP10 SOX9 HES1 ENG MKS1 SIX1 TBX3 HAND2 PIM1 BMPR2,18,regulation of cell proliferation involved in heart morphogenesis,MKS1 BMP10 EYA1 SMAD4 HAND2 GNG5 RBPJ SIX1 ENG FBXO38 MRPL22 NCOA7 APCDD1 ZNF689 DNAJC17 UBE2G2 THNSL1 DNAJC27,MGMT GPHN BANK1 NDP IL1F10 IKBKG PARD3 INCENP SSUH2 CCL7 SIAH3 ADD3 P2RY11 HELQ NIPSNAP2 IL17RC SNTA1 NCAPD2
GO:0003159,RHOA DLL4 RBPJ CTNNB1 CCM2 CSNK2B CXCR4 ADAMTS12 ACVRL1 PRKD2 STARD13 CXCL10 RHOB FGF1 ITGAX FOXP1,16,morphogenesis of an endothelium,CSNK2B DLL4 STARD13 CTNNB1 RBPJ FGF1 PRKD2 ACVRL1 PTPN7 DEPDC4 RPS26 AEBP1 CDC42EP4 ZFYVE19 NCOA6 IDNK,TLE2 ZNF48 EDIL3 PAOX ATP1A2 OR5D16 ZP4 SNRNP27 DNAJC7 CHRM1 SPAG17 SLC8B1 DGCR8 OPN5 CD1C SLC9B1
GO:0046654,DHFR GCH1 GART ATIC DHFR2,5,tetrahydrofolate biosynthetic process,DHFR2 GCH1 PIH1D2 TTLL7 NPR1,PPP1R14D USP17L1 ZPLD1 TENM2 RRP9
GO:0021849,NUMB AKNA NUMBL,3,neuroblast division in subventricular zone,AKNA ZNF2 HCFC1,PLAAT4 ZNF501 STT3B
GO:0021605,SLC24A4 NPR2 CNGB1,3,cranial nerve maturation,NPR2 HSCB RYR1,PTK2 GHITM ODF2
GO:1905288,ADCY10 PPARG IGF1 MFN2 E2F3 SOD2 SLC7A5 ATF4 PDCD4 RBM10 DNMT1,11,vascular associated smooth muscle cell apoptotic process,PDCD4 MFN2 DNMT1 IGF1 SLC7A5 COL28A1 CD14 FBXW12 NAP1L4 KDM3A POLR1A,DPH7 RIN3 CBLL1 MAST4 CAP2 ZNF84 UGT2B4 HBB GNPAT SYT1 CENPS-CORT
GO:0048710,CLCF1 NF1 TREM2 NOTCH1 MAG IL6ST LIF EPHA4 HES5 LDLR SERPINE2 TTBK1 BMP2 HES1 NR1D1 KDM4A NOG ID2 NR2E1 MBD1 F2 SHH MECP2 ID4 IL6 QKI DAB1 GPR37L1 BIN1,29,regulation of astrocyte differentiation,DAB1 IL6 MBD1 NOG TREM2 KDM4A HES5 HES1 NR2E1 ID2 MECP2 NOTCH1 ID4 LIF CAMK2G MRPL33 NR1I3 GFY TSPAN6 MSI2 FES NEK11 SNW1 RPL24 THOC2 FCGR2C FBXO27 SNED1 ATP6V1B2,ZDHHC4 CPEB1 NAT8L PER1 PURG MPEG1 RPP25L LRMDA AFDN BTBD9 GRM5 SURF4 COTL1 PI4K2B RPS2 DNPEP IGFBP7 CCR7 RAB11FIP1 MECOM MRPL42 NHSL3 ZMIZ2 DGKG ZNF135 FH COQ2 PWWP3A NLRP13
GO:1903897,NCK1 PTPN1 HSPA5 PPP1R15B PTPN2 ABCA7 TMEM33 BOK NCK2 AGR2 PPP1R15A,11,regulation of PERK-mediated unfolded protein response,BOK NCK2 PTPN1 PPP1R15A TMEM33 GPR183 RDH8 SNX24 DDX54 HSPB7 PGM2L1,ZNF671 EIF1AY CHAF1B ACTR8 NDUFAF8 CHRNA5 NT5E TSPYL5 SAT2 CYP2C8 MID1IP1
GO:0072125,BMP7 BMP4 WT1,3,negative regulation of glomerular mesangial cell proliferation,WT1 CELA3A OR2F1,LSM3 TERB2 CXCL16
GO:0031507,L3MBTL1 HAT1 SETDB1 BEND3 TASOR SAMD1 UHRF1 EZH1 TDRD9 EZH2 TPR TRIM28 HDAC2 MECP2 RRP8 BAZ1A MBD3L1 TNP1 RLIM CDYL UBR5 MACROH2A1 PHF2 MBD3 PCGF3 PIWIL2 SIRT1 SETDB2 RESF1 LMNA MBD3L3 HELLS MBD3L4 ZNF304 DNMT3A L3MBTL3 LMNB1 PIWIL1 NRDE2 ARB2A DNMT1 H1-0 BAZ2A BCL6 CENPV CDK2 DYRK1A EHMT1 TET1 METTL3 SMARCA5 HMGB1 LRIF1 TRIP12 SIRT2 BRCA1 LMNB2 KDM1A KDM5A MPHOSPH8 RIF1 BAHD1 PPHLN1 APOBEC1 YTHDC1 MBD3L5 PHF8 UBR2 ZNFX1 RBM15B MORC2 SMCHD1 SIN3A SUZ12 MBD3L2 PCGF5 SIRT6 SPTY2D1 HNRNPU DOT1L SUV39H1 RBM15 RB1 ATRX KMT2D HMGA2 MBD2 POLE3 SCMH1 CBX3 DDX4 HDAC1 ATF7IP MYC PPM1D ATF7IP2 JARID2 AICDA,98,heterochromatin formation,ARB2A TNP1 BCL6 DNMT1 TRIP12 NRDE2 BAHD1 UBR5 METTL3 HDAC1 MBD3L1 CDYL PIWIL2 PPHLN1 RBM15B SUV39H1 SETDB1 TPR BAZ2A TASOR L3MBTL1 H1-0 DOT1L BRCA1 ATF7IP2 ZNFX1 LMNA MBD3L3 MPHOSPH8 HNRNPU SMARCA5 MBD3 EZH1 SIN3A KMT2D MYC KDM5A HMGB1 SAMD1 EZH2 ZNF304 SCMH1 SUZ12 MORC2 SIRT2 PPM1D SMCHD1 POLE3 SETDB2 MYO19 ZNF24 GPD1L KSR1 TAB3 RFT1 TTL SLC2A13 CLC RAB15 CYP2E1 CPNE4 FMN1 NSUN6 DGKB TNNC1 ARHGEF16 PDE1B H2BC10 LDOC1 ARMC7 FOXJ3 PRDM2 DOCK3 POM121 LY6E RHOXF1 MMP9 MIOS ELAVL4 ARID5A SYNGR3 KLF16 AFG2A ZNF786 IGSF21 ZACN ASPRV1 LIME1 SREBF2 DHX29 ESR1 ABCC3 MAP10 ABCA13 CLDN16 ARHGEF26 BCO2 NDUFS2,WDR83OS ZIM3 RUNX2 MMP13 PALS1 PCSK5 HOXD12 CLEC5A TMEM138 HDGFL3 WDR35 NUCKS1 ORC4 ARID5B LGR5 MTAP OR51Q1 ADAP2 HMGN2 OLFM2 TSTD2 CYB5B STXBP4 KCNQ1 ARF6 PTPRZ1 CLIP1 ATP8A1 MAP3K21 CBX2 MSX2 DEFB127 PAXBP1 MEP1B KRTAP1-3 PACS2 AIFM2 METTL13 EPHB3 NHEJ1 SHFL MYH14 WDR11 NFKB2 RPS2 ANXA2 KLHL4 SLC25A1 NT5C3B MSH5 KIAA0319 DAD1 C1S CREB3L1 IMPG2 ADGRA1 ECHDC2 GIPR MRGPRX1 SLC8A3 TASP1 RAB39B ZNF586 SVBP TNFAIP8L1 ARHGAP27 RORC TMED7 GPR137B GRIA2 PAM AOPEP WNT2B RP1L1 EPCIP TAF9B FDX2 RANBP1 TRIM13 HELQ GABPB2 SMG1 GOT2 RGS19 TRIM69 KCNE3 CD2 NRSN2 CDK3 TRMT61A PRAME OR10X1 TWSG1 PRM2 C6orf62 NKX2-1 TBC1D2B IMMT
GO:0002645,LILRB2 FOXJ1 HLA-G FOXP3 TGFBR2 CD3E CBLB ITCH IDO1 IRAK3 CD274 LILRB4,12,positive regulation of tolerance induction,IRAK3 HLA-G IDO1 CD274 ITCH TGFBR2 ZNF33B SYNRG GBP7 BUB3 LTBP2 ZNF728,CCNJL JMJD6 GALNT1 HOXC4 ST6GAL1 CLNS1A NDN NSUN6 HOXA5 CLEC4G ARMH4 ZNF581
GO:0031952,RAP2C GPNMB NEK10 TESK1 NBN CALM2 PPP2R5B MRE11 GREM1 RAP2B TAOK2 ENPP1 CHP1 VEGFC ERRFI1 PDGFB CAV1 PDGFC EPHA7 MOB1B VEGFA TNKS1BP1 CALM1 PDGFD RASSF2 CALM3 ADIPOQ EEF2K INS PTPRC NLRP12 RAP2A RAD50 TOM1L1 MVP PRLR IMPACT DDX3X PDGFA,39,regulation of protein autophosphorylation,TOM1L1 PTPRC RASSF2 PDGFA RAP2B INS PPP2R5B CAV1 NBN CHP1 MVP RAP2A TESK1 MRE11 ENPP1 PDGFD CALM3 NLRP12 GREM1 PFDN6 MS4A6E TAPBP DNAI1 CYP11A1 PCM1 KIF26A REEP3 POMGNT1 SMC5 SETD6 ZC3H3 EVC MGLL BCR CUBN PCSK9 H1-2 PLD4 BRPF1,HBD TNFRSF12A TRAP1 ZDHHC23 RNF112 DNAJC24 FBLN7 ATRIP CNOT10 PLA2G6 MRPS31 EXOSC10 MFSD2B PCDHA13 IDI2 GGA2 BVES DKK4 OR5AN1 CYP4F11 FBN2 SPSB4 CFAP20 NMUR1 INPP5B PDZRN3 TAF4B BRD1 CSNK1G2 WDR74 SF3B6 WIPI1 CCDC115 ZNF100 FZD5 RNF166 GJB7 OR5B3 CFL2
GO:0043605,PIPOX UROC1 NIT1 DLST AADAT HAL ADA TDO2 AASS NT5C XDH PRODH2 AMDHD1 ALDH4A1 OAT ALLC GDA PM20D1 PRODH FTCD,20,amide catabolic process,PIPOX XDH AMDHD1 HAL PRODH NT5C AADAT NIT1 FTCD PRODH2 HSPA14 KCTD4 SETDB2 GEMIN7 KITLG VGLL3 RNF169 HEXIM1 PPP1R14B NR1H3,SERF1B OR8D2 SLC29A2 ELK3 ASB13 DNAJC9 CSTA SEC24A GZF1 AHNAK CPLANE2 DYNAP SALL1 LRRN2 WRAP53 GNAL MYO9B FGGY FAM171A1 HOXC12
GO:0033014,SLC25A39 ATP5IF1 TMEM14A RSAD1 FXN ABCB10 TMEM14C ALAS2 IREB2 FECH SUCLA2 HMBS CPOX SLC6A9 IBA57 ABCB7 UROD TMEM14B SLC25A38 ALAD COX10 PPOX COX15 SLC11A2 TSPO SPTA1 ALAS1 NFE2L1 PGRMC1 UROS ABCB6 SRRD FLVCR1,33,tetrapyrrole biosynthetic process,ABCB6 ALAD ATP5IF1 COX15 CPOX SUCLA2 TSPO ABCB10 UROD FXN TMEM14A FLVCR1 ABCB7 TMEM14C ALAS2 COX10 SLC7A9 SKA3 TBC1D4 CENPT CNGA4 ERI2 CAPNS1 IFNA6 BTN3A3 BEX5 CNN1 PRICKLE3 TPM4 CALHM4 GNG14 FGF13 GHITM,SFTPD TBCB RGS12 FOLH1 CDR2L TUBG2 KIF27 AFP SCOC DNLZ H3C7 CAMK2N2 RNF34 COPZ2 TJAP1 FCRL6 SPINK5 IQCA1 TPX2 RHBDF1 EMD SLC35B1 SLC25A34 DIMT1 IHO1 SCLY AIF1 DYNC2I1 FNBP1L RUSC2 OR52I1 GNG10 TBC1D13
GO:0033505,CLUAP1 CDK20 GLI2 NODAL,4,floor plate morphogenesis,CDK20 NODAL SNX4 CLEC16A,ZNF528 CD70 ANXA7 MPPED1
GO:0045591,KLHL25 KAT5 FOXO3 SOX12 AMBRA1 LGALS9 VSIR BTN2A2 IL4I1 DUSP10 CD46 IL2RG LILRB2 HLA-DRB1 HLA-DRA SOCS1 LILRB4 HLA-G CR1 FOXP3 IFNG BCL6 IL2,23,positive regulation of regulatory T cell differentiation,SOX12 HLA-DRA SOCS1 AMBRA1 CD46 BTN2A2 FOXO3 KLHL25 LGALS9 HLA-DRB1 IL2RG ZNF836 KLHL6 FOXA1 RRP7A ZNF852 EIF1 CCDC117 GPR35 NOXA1 APOBEC3H STK35 UNC119,PLA2G12A CD300H ACTL8 BACE2 METTL6 DNPEP LMCD1 LIPM BBS1 RNF113A INSYN2B STAT1 ZFP14 MAD2L1 TMBIM6 ZSCAN22 TNFRSF10B TGIF2LX CD70 PLGRKT CRLF3 FEN1 PDZD8
GO:0043686,STT3A STT3B PDF,3,co-translational protein modification,STT3B NPAS4 EPB41L3,DENND3 TNNT3 GLRA3
GO:0001561,HACL1 HAO1 PHYH HAO2 SLC27A2 SLC25A17 PEX13 ILVBL,8,fatty acid alpha-oxidation,PHYH HAO1 ILVBL SLC27A2 OR56A5 PECAM1 GPRASP2 STAM,FAF2 EARS2 CALM3 CEP295NL UBL4B VPS41 RALA TROAP
GO:0042775,NDUFS8 NDUFS5 UQCRC1 NDUFB8 SDHA NDUFS1 COX6A2 COX8A COX4I2 COA6 ND3 CHCHD2 SDHD CDK1 CYCS NDUFB10 PARK7 NDUFB7 ND2 NDUFB2 NDUFA1 COX5B NDUFAB1 COX6B1 ND4L NDUFB1 NDUFV3 COX7A1 UQCRC2 BID NDUFA2 CYC1 NDUFC2-KCTD14 COX6C NDUFA8 COX4I1 CYTB COX7B2 ND6 NDUFB6 NDUFB5 DGUOK COX8C DNAJC15 NDUFV1 UQCRH PINK1 NDUFA6 UQCR11 CCNB1 COX1 ND1 NDUFA4 NDUFS2 TAFAZZIN UQCRHL ND5 NDUFA7 GHITM NDUFS6 ND4 COX3 COX5A SDHAF2 COX15 NDUFV2 COX6A1 UQCR10 UQCC3 NDUFA9 NDUFA12 NDUFB9 NDUFS7 NDUFB4 ISCU NDUFS4 UQCRFS1 COX7B COX7C NDUFS3 COX7A2 SDHC NDUFA3 COX2 NDUFA10 SDHB NDUFC2 NDUFAF1 COQ9 SNCA NDUFB3 AFG1L UQCRB COX7A2L NDUFC1 UQCRQ DLD NDUFA5,98,mitochondrial ATP synthesis coupled electron transport,NDUFB4 COX4I1 UQCRC1 NDUFAF1 COX5B NDUFA4 NDUFA9 CYTB DLD SDHC NDUFA8 SNCA DNAJC15 NDUFB6 NDUFS8 BID COX6A2 COX1 CDK1 NDUFB3 NDUFA7 SDHB GHITM COQ9 NDUFB10 SDHD COX7B2 CCNB1 COX6C NDUFB8 NDUFA5 ND4 COX7C ND6 ND3 UQCR11 NDUFV3 COX8C NDUFA1 DGUOK NDUFC1 ISCU UQCRFS1 COX3 ND5 NDUFA12 UQCC3 NDUFV2 SDHA OR5T3 GMIP GSG1L PTDSS1 ACTL6A SAA2 AKAP8 GAS7 FADS2 ZNF408 EIF2AK1 OR4A5 SNX19 TCFL5 SEC11C TWIST2 RAB6C ACTR3 RBPMS LTF DOCK4 PPIAL4G SMARCB1 ZPLD1 OR8B4 MATN1 FER1L6 EIF3D KDSR SENP8 MFAP1 SERPINA11 WNK2 B4GALT2 CKB IER3IP1 ZNF282 SIRPG TXNDC2 IFNL4 NEUROG2 EIF2AK3 CUX2 DDX24 LMOD2 TJP2 SS18L2 OR13H1 OR10G7,SLC16A1 RSPH9 OR10A7 PRMT9 PRAMEF27 FGFR1OP2 CATSPERB GNA14 RASGEF1C SLC13A1 PIGP SPRED3 PLCH1 MED20 RBCK1 EIF1AX GALNT1 RBFOX2 SYTL2 ATAD2B TKFC CYP46A1 PLPPR2 TENT4B RPL28 ENG MTMR6 CTAG2 KLRG1 RAB40B PMCH NOG OR13H1 MTARC2 OR56A1 MRPS10 ZNF609 NALF2 ELOVL5 LTC4S MCIDAS PPM1A KCNJ3 ALG9 TSSK4 OR10J5 KRTCAP2 IL22RA1 SLC49A4 WWC2 AGRP ATRX RAB6D CHRD TTLL7 RASSF9 KRT5 SH3RF2 DDX28 EPHA5 NPTX1 STT3A ROBO4 TBC1D30 SRRT HAT1 CKLF TUBA1C DLG3 PPIAL4G TRIM49 GOLGA8J LST1 JUN KIF2A CDC45 GID8 CRISPLD2 TBC1D1 LOC102724560 RRH APCS ZNF532 FUT9 SEPTIN10 SYNGR3 FRZB TANC1 ADRA1A CA14 ITIH4 TBCEL TRMT1 MPC2 POLE EFCAB7 CABYR OR51A2
GO:1901021,CALM2 ATP2A1 STIM1 STIM2 STAC2 CACNB2 AKAP6 GSTO1 ANK2 VMP1 TRDN JPH2 RYR2 PKD2 GSTM2 HTT CALM1 SLC9A1 STAC3 HAP1 CACNB3 CALM3 STAC CACNA2D1 CRACR2A STIMATE NIPSNAP2 CASQ1 ATP1B1 P2RY6,30,positive regulation of calcium ion transmembrane transporter activity,GSTM2 HAP1 CASQ1 JPH2 CACNB2 CRACR2A NIPSNAP2 STAC3 ANK2 TRDN CACNB3 STIM2 ATP1B1 CALM2 ATP2A1 TNPO1 CRY1 EOMES SLC7A6OS ACKR3 MVD RTN4IP1 DCUN1D5 RPS17 HLA-B NDUFC2-KCTD14 CD83 GLG1 PPP1R12C ZKSCAN7,NTS GPHB5 SIL1 TNFRSF8 OR2A2 LRRC59 BANF2 HELB SYK RABIF CCL3 USP49 SLC25A33 TMPRSS5 CELA2B SYT17 RAP2A CRYGC GMFB PIK3R6 SCARA5 PHC1 PEX10 SLC39A11 NKX2-5 RAB6B NEFH TMEM8B ZNF329 H2AC17
GO:0071514,MAEL ZDBF2 PICK1 DIRAS3 NDN IGF2 PIK3CA ARID4A ZFP57 DNMT3A TRIM28 GSK3A CDKN1C MECP2 DNMT3L CTCF PRMT7 KDM1B ARID4B CTCFL,20,genomic imprinting,PIK3CA NDN MAEL KDM1B ARID4B CTCF PRMT7 PICK1 DNMT3A CTCFL SIAH2 FGF23 UGT1A9 SPDL1 RNF157 SLC17A3 GRM3 DOK1 TSPYL2 CAB39L,SOX5 SV2B PGK1 TCAF2 DUSP18 PRMT8 UCN2 OR4D11 ELP5 TAS2R42 MTCL1 SLC2A7 ANKRD27 TP53I13 RAB41 LIPC ZNF705G FGF6 RXRG CFL2
GO:0070944,F2RL1 F2 SCNN1B TREM1 ELANE CTSG TUSC2 CXCL6 NLRP6 MYD88 AZU1,11,neutrophil-mediated killing of bacterium,NLRP6 ELANE CXCL6 F2RL1 MYD88 OSBPL3 CEP120 COMMD9 NPR3 EBP FRS3,FBXL20 KCNJ3 TRIM49C DHRS11 NHLH2 ACCS ZNF274 PLXNA1 ITIH4 MSI2 SLC7A5
GO:0001958,EXT1 COL13A1 FGFR3 MMP13 IFT80 NAB1 TMEM119 SMPD3 PHOSPHO1 MMP16 DLX5 NPR2 FOXC1 PEX7 INPPL1 BMP6 MEF2C BPNT2 TEK COL2A1 RUNX2 SCX MEF2D LOC102724560 BMP4 MMP14 COL1A1 CBS CSGALNACT1 ALPL FGF18 NAB2,32,endochondral ossification,FOXC1 TEK FGFR3 MMP14 CSGALNACT1 RUNX2 PEX7 EXT1 DLX5 BMP6 MEF2D MEF2C MMP16 NAB2 BMP4 COL13A1 PNPLA6 NAXE EFTUD2 ZNF548 AKAIN1 KAT2B DRD1 DOK5 CLOCK IPO9 MLYCD LMLN FANCI ZNF266 EIF2B3 SLC9C1,DHDDS B2M PPTC7 KRT6C DHRS3 NMS SLC13A5 MYO5A LRTM1 ROBO1 INSIG1 TBC1D8 PRKCE PRRG3 MACROH2A2 ATP8B4 TCERG1L FUOM CRCP GRIN2B HEPACAM ACAT2 SLC25A37 C1QL3 DNAH14 SPATA19 CAND2 PRDX5 HNRNPF MTUS1 SCPEP1 RPL35
GO:0002922,TREM2 IL17F KLK3 FCER2 HPX ACOD1 LTA ZP3 PGC KLK5 CCR7 TNF NOD2 IL1B ZP4 KLK7 PTPRC CR1 C3 FCGR2B PHB1 IL17A,22,positive regulation of humoral immune response,KLK5 TNF HPX FCGR2B CR1 LTA PGC IL1B KLK7 CCR7 ZP3 ACTR3 ATR OLFM3 TGDS TLL2 TMPRSS4 NUBPL RAB11FIP5 CD300C JHY CNPY4,TRPM7 ADAMTSL1 LALBA PRKACB ADAM20 BMP7 SOAT2 ANKRD2 XRCC3 NDUFB3 GINS4 OR6C74 SPIN2A SCGB2A2 TMEM276 U2AF1L4 CCNK TMEM163 TBC1D3H USP45 C15orf48 ICA1
GO:0007060,MEIKIN TEX11 M1AP MLH1,4,male meiosis chromosome segregation,MEIKIN TEX11 PARD6G PJA1,KRTAP6-2 RUVBL2 LRRC24 SSBP1
GO:0030575,DYRK3 HIPK2 ETS1 USPL1 CELF3 PML HABP4 AFF2 SERBP1 USP50 WRAP53 ZPR1 SRPK2 SF1,14,nuclear body organization,PML USPL1 AFF2 USP50 SF1 HABP4 CELF3 RNASE8 IFNB1 EXOSC1 CX3CL1 EIF1 BOK EML5,ZNF665 ATP6V1G3 IKBKE SIM1 CEBPB GRPR GAL3ST2 RLIG1 CDK5R1 TSPAN32 AAMP KHDRBS2 ULK1 SRSF5
GO:0060397,PTPN1 JAK2 LYN STAT6 STAT3 TYK2 STAT5B STAT5A JAK1 JAK3,10,growth hormone receptor signaling pathway via JAK-STAT,LYN STAT3 JAK3 STAT6 STAT5B OR52B6 ZMAT3 HS6ST3 VGLL3 CLEC3B,ABTB2 CABP1 SLAMF8 TNP2 TRIM13 CHRNA7 SMIM22 RGS21 CLDN14 FUCA2
GO:0042640,WNT5A CTNNB1 SPINK5 WNT10B FERMT1,5,anagen,SPINK5 WNT10B NFE2L3 RB1 NAE1,GJC2 TACC2 BNIP1 ULBP2 PLLP
GO:0060180,THRA AVP NCOA1 THRB AVPR1A DRD5 PPP1R1B,7,female mating behavior,THRB THRA NCOA1 RPAIN HES2 CALY ATP6V0D1,ADGRB2 OR10A4 ATP1B2 CSF1R NKX6-2 SNX30 ATG7
GO:2001239,PF4 NF1 CX3CL1 SGK3 RIPK1 STRADB GFRAL GDNF WWOX EYA2 FGFR1 PRDX2 TERT PPP2R1A PPP2R1B EYA3 MCL1 HTRA2 ZC3HC1 TNF MAPK7 FGF10 CTNNA1 HSPA1A INHBA C8orf44-SGK3 BCL2L1 AKT1 SNAI2 MAP2K5 SRPX CSF2 IL7 IL1B IFI6 COL2A1 IL1A UNC5B GATA1 BCL2 PPP1CA EYA4 EYA1 RET HSPA1B,45,regulation of extrinsic apoptotic signaling pathway in absence of ligand,PPP1CA C8orf44-SGK3 WWOX RET PRDX2 NF1 CTNNA1 TERT EYA2 UNC5B SNAI2 CX3CL1 PF4 HTRA2 CSF2 GFRAL COL2A1 FGFR1 MCL1 IFI6 AKT1 INHBA SLC35B1 LGALS2 OR2T10 SUPT16H DNAAF2 KAT2B SLC9A3 ADA MYO5B LIPC ZNF567 MEGF9 CYP51A1 CYP19A1 SALL1 IRF5 ME3 TSKU RMDN3 OR8H3 PDCL3 SV2B TRIM65,IAPP RPL37 BTN3A3 ZNF180 NUDT21 GTPBP4 DMAC2 STAT5A LPGAT1 TRIO PRPF4 HSFX3 NDUFB1 ZDHHC12 POLG2 STX10 SENP5 NUP107 MARCHF5 XXYLT1 ASB6 YBX1 PLPP1 DYRK1B IPO8 FBXO5 SMPD2 RUVBL1 BHLHE41 ATAT1 ACTN4 CEP57L1 TCF4 NFE2L1 HOXD8 ZNF20 OR2T2 KNTC1 CDC16 SGMS1 NLRP8 EFNA2 SMARCD2 PPID CCNA2
GO:0060768,EAF2 NKX3-1 AR CTNNB1 NOTCH1 SHH WDR77 SERPINF1 STK11 CDKN1B,10,regulation of epithelial cell proliferation involved in prostate gland development,WDR77 STK11 EAF2 CTNNB1 NKX3-1 ND5 GNB2 GPR173 CC2D2B GTF2H2C_2,GUCY1A1 TMUB2 TLX1 TOB1 HJURP TDRD7 PMFBP1 PPM1N NOTCH3 STYK1
GO:0090259,PTPRO ATOH7 POU4F2 SLIT2,4,regulation of retinal ganglion cell axon guidance,PTPRO SLIT2 VCX DNAH8,GOLGA7 MUC6 PPRC1 PCDHA1
GO:0120187,CDK9 SIRT6 VRK1,3,positive regulation of protein localization to chromatin,SIRT6 TSPYL1 GPR137,PRMT5 UAP1 PAPSS1
GO:0006098,RPIA TP53 TIGAR PGLS SHPK DERA RBKS RPEL1 RPTOR ACACB H6PD PGD PGAM1 G6PD MLST8 ALDOB MTOR TKT RPE PRPS2 TALDO1,21,pentose-phosphate shunt,RPEL1 RPTOR G6PD SHPK DERA TKT TP53 RBKS PGLS PGD AGAP4 PHF2 SLC10A7 PLA2G2F ANXA7 NCBP1 ZRSR2 NOBOX ASB1 CA7 TYR,SP140L IL4 SQLE NCK2 PTPRO ATG7 GAGE2B RBP3 MRGPRD ZKSCAN4 UTP4 GABARAPL2 ZNF20 NKX1-1 C10orf90 ARK2C FAM3C SLC9A7 TAL2 RPA3 CCSER2
GO:2000553,DENND1B CD81 GATA3 NLRP3 IL4 XCL1 PRKCZ RSAD2 IL6,9,positive regulation of T-helper 2 cell cytokine production,CD81 GATA3 IL6 NLRP3 UBE2V2 MTRFR LEMD3 BTG2 LRIT1,INHBC CNTN6 BAZ2A PHETA2 CDKN1B SLC7A4 GP5 ZNF600 ATP6V0C
GO:0006419,AARSD1 AARS1 AARS2 PTGES3L-AARSD1,4,alanyl-tRNA aminoacylation,AARSD1 AARS1 OSGIN2 SSR2,TNFRSF13C UBE2NL VSX2 POLG2
GO:0051754,BUB1 PPP2R1A BUB1B MEIKIN,4,"meiotic sister chromatid cohesion, centromeric",BUB1 MEIKIN PTAR1 CCDC3,RAPGEF6 SLC30A8 NRN1L CCL19
GO:0072079,PAX8 GDNF SOX9 GREM1 HNF1B WNT9B HES5 CTNNB1 NOG IRX1 IRX2 OSR1 SIX1 IRX3 SIX4 WNT6 HS2ST1 PAX2 SOX8 GATA3,20,nephron tubule formation,WNT6 GREM1 IRX2 NOG GDNF SIX1 HES5 SOX9 CTNNB1 HNF1B LEP EVA1C ACADS FUT3 SLC22A14 LONP2 SLC25A2 ANXA7 COL19A1 MYBPC1,TMEM117 ALG5 PSMA6 HMGB2 PCDHB13 LY6G6D GMNN SGPL1 CAND2 RSL24D1 XPNPEP3 RPL4 ZNF830 SEMA3B NAT2 LIMK2 SCML1 MATR3 TNFAIP2 TYROBP
GO:0033627,RAC3 CYP1B1 ITGA7 FERMT1 PLAU ITGB6 ADA DPP4 JAM3 COL16A1 ITGAE PTPN6 FYB2 NEXMIF PTK2 WNK1 SFRP2 ITGB7 ITGB3 NCKAP1L LYN ACER2 ITGA2B ITGAL ITGA1 ITGA4 MUC1 ITGAX LIF ITGA10 PDE3B ADAM17 ITGA3 EMILIN2 PLPP3 EFNA1 EPHA2 EPHA8 MMRN1 ITGAM CRK PTPN11 CIB1 P2RY12 ITGAD PIK3CG HRG EXT1 ITGAV ITGA2 VTN ITGBL1 SWAP70 ITGB5 ITGB4 SNAI2 CCN3 ITGB2 CRKL FOXC2 ICAM1 PODXL CCL5 SKAP1 CXCL13 SYK LPXN ITGA6 SERPINE1 PIEZO1 TGFB2 ITGA5 ITGA9 TESC ITGA8 ITGB1 CCL21 ITGB1BP1 ITGB8 CD3E FERMT3 NPNT EMILIN1 FBN1 ITGA11 ADAM9 RET IFT74,88,cell adhesion mediated by integrin,SNAI2 ITGB8 SKAP1 ITGAL ITGB1BP1 ITGB2 ITGA8 CCN3 VTN FBN1 PIK3CG ITGA1 SYK CD3E ITGA10 ITGA6 PTK2 TESC LYN EMILIN2 PDE3B CRKL MMRN1 ITGB4 CRK DPP4 ADA WNK1 ITGA4 EXT1 PTPN11 SFRP2 NPNT P2RY12 ITGA7 SWAP70 ITGB6 TGFB2 ITGBL1 RAC3 ITGB7 ITGAE HRG CIB1 TNNI3K GLUD1 COMMD3 CSKMT ATP6V0E2 PRDM11 AQP9 PRSS3 SIPA1L2 CSF2 HIRIP3 PPID PDCL2 ZNF23 CEP57 AGAP4 ZFX PBX2 CHKB GIN1 NUDT5 IFT81 SPIC CYP2C19 SNAPC2 TAS2R14 DUS3L TENT4A SPIRE1 NET1 ARSG SLC35G1 APOC4 HCFC1 SRY SRD5A2 NRG1 ZNF235 ALMS1 PDSS1 PARG SPATA31D1 CDC5L NUBP1,TRIP13 ABCF1 PLK2 EIF4E ULK2 GPKOW SLC39A3 TCERG1 PLAG1 ERCC6L TRIM7 MACROH2A1 PHYHIP CRYBB3 LOC102723553 SNN ADI1 ABCA1 SETD2 CYP4B1 BCL7A OR51E1 TEKT2 OR8D1 MRPL33 SLC37A1 HSD17B6 METTL21C HOXB13 PUDP NAXD GABPB2 SUMO3 ATG16L2 USP17L30 SIRT7 TRMT6 CDO1 NDUFA13 AP5Z1 CCSER2 CENPX SURF1 GCDH VPS37C FASTKD5 PPEF2 CENPL DCDC2C ZNF143 GPR35 H2BC12 CASD1 ENSA USF2 NAMPT UQCC1 ARRB1 TAF6 SHKBP1 CAT TH NEURL1B POU2F2 SULT1B1 UBXN6 PDCD1 COLGALT1 PROK2 ACTR1A YOD1 RELT NCR1 DLGAP2 KRT26 MINDY4 CISD3 TMEM79 CCZ1 IRAK2 CWC25 ADAT2 ZNF440 TBC1D10C NPRL2 UGT1A8 NALF1 GSDMC
GO:1900116,CER1 MICOS10-NBL1 GREM2 ZNF653 LTBP1 LRPAP1 DAND5 FBN1 CD46 FBN2 NRROS NBL1 GREM1,13,extracellular negative regulation of signal transduction,NRROS FBN2 CER1 DAND5 LRPAP1 FBN1 TOMM22 ZBTB34 TNFRSF10A PARD3B APTX DEFB115 NR6A1,BAHD1 SLC27A1 PET100 SPATA31C1 DOCK4 CHPF2 MRTFA KTN1 ARG2 SLC2A12 DDX10 KRT18 APOBEC3A
GO:0010611,TOMM70 MLIP ROCK2 NOTCH1 BMP10 IL6ST PDE9A LMNA YY1 PARP2 NR4A3 ADCY10 LMCD1 GATA5 CAMK2D IGF1 AKAP6 EDN1 FOXO1 RGS2 ACACB TRIM63 PDE5A GSK3A ROCK1 G6PD HAND2 ATP2B4 ADRA1A MTPN SLC9A1 TNFRSF1A TWF1 PPARA GLRX3 P2RX4 TNFRSF1B CAV3 AGT CTDP1 PARP1 PPP3CA PPARG PRKCA BECN1 SMAD4 RGS4 SMAD3 TRPC3 PI16 FOXP1 JARID2 MEF2A,53,regulation of cardiac muscle hypertrophy,CAV3 PARP2 MTPN PPARG IL6ST SMAD3 PDE5A EDN1 YY1 RGS4 ADCY10 PDE9A P2RX4 AGT PI16 ROCK2 HAND2 BMP10 TRIM63 MEF2A MLIP ROCK1 IGF1 SLC9A1 TRPC3 NR4A3 MLX PTPMT1 PLXND1 VAX1 SLC25A16 DBX1 MIOS RGR C18orf32 PNRC1 PPY FBH1 NKAPL H2AJ PGA3 PPIAL4F ATP7B PLEKHG2 ZBTB10 MID1IP1 SEZ6L ADCK2 FCRL2 MFSD9 OR10Z1 IL36RN FAM98A,LRP8 RNF152 CDK2 CDH8 POP4 WDR75 PERP PRPF19 DOCK10 HBA2 RNF130 MXD3 SERPINC1 IGLL5 CACHD1 RAB11FIP2 FAM170A ZC3H10 GPR37 ANXA6 RSPH14 DKK2 EXOSC7 COA1 MPEG1 EXOSC9 EPS15 TMOD3 TMEM150C SAP130 H2BC1 ANO2 TAFA3 VPS16 ADGRF1 GATC CTLA4 PIWIL2 IQCA1L ZNF302 TGFB1I1 MPG HMG20A COL22A1 RLF RIF1 NFRKB SLC12A1 ZNF699 UBR7 TMED7 UBR4 ZNF667
